,date,subject,headline,headline_link
0,2022-09-02,Tennis,Serena Williams Eliminated From U.S. Open in Her Final Grand Slam Match,https://www.wsj.com/articles/serena-williams-retirement-us-open-11662171278
1,2022-09-02,U.S.,Eight Migrants Die Trying to Cross Rio Grande,https://www.wsj.com/articles/eight-migrants-die-trying-to-cross-rio-grande-border-patrol-says-11662170676
2,2022-09-02,Asia,U.S. Approves $1 Billion in Arms Sales to Taiwan ,https://www.wsj.com/articles/u-s-approves-1-billion-in-arms-sales-to-taiwan-11662166386
3,2022-09-02,Europe,"Russia to Keep Nord Stream Pipeline Shut, Citing Mechanical Problems ",https://www.wsj.com/articles/russia-to-keep-nord-stream-pipeline-shut-citing-mechanical-problems-11662137957
4,2022-09-02,Business,Elon Musk and Twitter Set to Face Off at Omnibus Hearing ,https://www.wsj.com/articles/elon-musk-and-twitter-set-to-face-off-at-omnibus-hearing-next-week-11662161244
5,2022-09-02,◆,WSJ News Exclusive,https://www.wsj.com/articles/cvs-is-in-advanced-talks-to-buy-signify-health-11662155701
6,2022-09-02,Latin America,Argentines Show Support for Vice President After Attempted Attack,https://www.wsj.com/articles/argentines-show-support-for-vice-president-after-attempted-gun-attack-11662145983
7,2022-09-02,◆,WSJ News Exclusive,https://www.wsj.com/articles/u-s-again-stops-iran-from-seizing-naval-drones-11662142591
8,2022-09-02,Risk & Compliance Journal,"Visa, Mastercard, Amex Urged to Track Gun Sales",https://www.wsj.com/articles/visa-mastercard-amex-urged-to-track-gun-sales-to-fight-crime-11662160316
9,2022-09-02,Health,FTC Investigating Amazon Deal to Buy One Medical Clinics,https://www.wsj.com/articles/ftc-investigating-amazon-deal-to-buy-one-medical-network-of-health-clinics-11662157363
10,2022-09-02,Review & Outlook,"Another Week, Another Leak at the IRS",https://www.wsj.com/articles/another-week-another-leak-at-the-irs-taxpayer-data-11662153431
11,2022-09-02,Review & Outlook,California’s Fast-Food Bill Whopper,https://www.wsj.com/articles/californias-labor-whopper-fast-food-restaurants-gavin-newsom-11661968646
12,2022-09-02,Review & Outlook,Joe Biden Holds a Trump Rally,https://www.wsj.com/articles/joe-biden-holds-a-donald-trump-rally-speech-maga-republicans-white-house-11662149768
13,2022-09-02,Politics,Environmental Lawyer Tapped to Lead White House Regulatory Office ,https://www.wsj.com/articles/environmental-lawyer-tapped-to-lead-white-house-regulatory-office-11662157654
14,2022-09-02,Review & Outlook,Russia’s Gazprom Brings an Early Winter to Europe,https://www.wsj.com/articles/gazprom-brings-winter-to-europe-vladimir-putin-russia-natural-gas-pipeline-11662148280
15,2022-09-02,College Football,"College Football 2022: Alabama Is No. 1, but Everything Else Is Changing",https://www.wsj.com/articles/college-football-2022-alabama-11662087268
16,2022-09-02,U.S.,"Jane Fonda Reveals Cancer Diagnosis, Is Undergoing Chemotherapy",https://www.wsj.com/articles/jane-fonda-reveals-non-hodgkin-lymphoma-diagnosis-is-undergoing-chemotherapy-11662154358
17,2022-09-02,Masterpiece,"Out of Many Parts, One Painting",https://www.wsj.com/articles/still-life-with-fruit-and-nuts-robert-s-duncanson-masterpiece-national-gallary-of-art-raphaelle-peale-joseph-decker-john-f-peto-martin-johnson-heade-hudson-river-school-thomas-cole-nicholas-longworth-david-lubin-george-caleb-bingham-fitz-henry-lane-john-f-francis-11662154746
18,2022-09-02,◆,WSJ News Exclusive,https://www.wsj.com/articles/u-s-army-maintenance-error-led-to-chinook-helicopter-grounding-11662154212
19,2022-09-02,Commentary,The Last Gasp of 20th-Century NASA,https://www.wsj.com/articles/the-last-gasp-of-20th-century-nasa-space-launch-moon-orion-spacex-boeing-rocket-11662148944
20,2022-09-02,College Football,College Football Playoff Will Expand to 12 Teams by 2026 ,https://www.wsj.com/articles/college-football-playoff-expansion-12-teams-11662153769
21,2022-09-02,Cross Country,How Teachers Are Secretly Taught Critical Race Theory,https://www.wsj.com/articles/if-students-dont-learn-critical-race-theory-why-do-teachers-pacific-educational-group-school-board-administrators-students-class-11662150413
22,2022-09-02,Business World,CO2 Fight Dies (Again) in Zaporizhzhia ,https://www.wsj.com/articles/co2-fight-dies-again-in-zaporizhzhia-ukraine-russia-nuclear-power-plant-energy-disaster-europe-accident-11662149935
23,2022-09-02,U.S. Markets,Stocks Turn Lower ,https://www.wsj.com/articles/global-stocks-markets-dow-update-09-02-2022-11662114368
24,2022-09-02,Health,FTC Appeals Judge's Dismissal of Suit Against Illumina,https://www.wsj.com/articles/ftc-appeals-judge-s-dismissal-of-its-lawsuit-against-illumina-11662149854
25,2022-09-02,Business,Chobani Withdraws IPO After Delays,https://www.wsj.com/articles/chobani-withdraws-ipo-after-delays-11662152221
26,2022-09-02,Tech,Meta Acquires Berlin Startup to Boost Virtual-Reality Ambitions,https://www.wsj.com/articles/meta-acquires-berlin-startup-to-boost-virtual-reality-ambitions-11662147631
27,2022-09-02,Credit Markets,Bond Yields Fall on Jobs Report,https://www.wsj.com/articles/jobs-report-looms-over-latest-yield-climb-for-u-s-treasurys-11662073979
28,2022-09-02,Crossword,"Foodies (Saturday Crossword, September 3)",https://www.wsj.com/articles/foodies-saturday-crossword-september-3-11661986723
29,2022-09-02,Variety Puzzle,"Rows Garden (Saturday Variety Puzzle, September 3)",https://www.wsj.com/articles/rows-garden-saturday-variety-puzzle-september-3-11661986897
30,2022-09-02,Tech,Parler Returns to Google’s App Store,https://www.wsj.com/articles/conservative-social-media-app-parler-returns-to-googles-app-store-11662148624
31,2022-09-02,Risk & Compliance Journal,Wells Fargo Fined $22 Million for Alleged Whistleblower Retaliation,https://www.wsj.com/articles/wells-fargo-fined-22-million-for-alleged-whistleblower-retaliation-11662148588
32,2022-09-02,Politics,"VA to Provide Abortion Services for Health Dangers, Rape and Incest ",https://www.wsj.com/articles/veterans-affairs-to-provide-abortion-services-for-health-dangers-rape-and-incest-11662135780
33,2022-09-02,Commentary,Woke Ideologues Are Taking Over American Art Museums,https://www.wsj.com/articles/when-connoisseurs-yield-to-commissars-art-history-museums-woke-politics-ideology-mission-painting-renaissance-activists-11662139109
34,2022-09-02,Commentary,The Americans Who Never Went Back to Work After the Pandemic,https://www.wsj.com/articles/the-americans-work-after-pandemic-retire-males-age-payments-covid-vaccines-pandemic-income-stimulus-consumer-11662138942
35,2022-09-02,Politics,"Biden Seeks $47.1 Billion to Fight Covid, Monkeypox, Aid Ukraine ",https://www.wsj.com/articles/white-house-seeks-44-5-billion-to-fight-covid-and-monkeypox-aid-ukraine-11662136701
36,2022-09-02,◆,WSJ News Exclusive,https://www.wsj.com/articles/pentagon-aims-to-speed-arms-sales-to-allies-to-better-compete-with-china-11662146866
37,2022-09-02,Business,"From Cleaners to Coffee, the Executive Taking Over Starbucks ",https://www.wsj.com/articles/new-starbucks-chief-is-returning-to-u-s-after-running-lysol-maker-reckitt-benckiser-11662074493
38,2022-09-02,U.S. Economy,"U.S. Added 315,000 Jobs in August",https://www.wsj.com/articles/august-jobs-report-unemployment-rate-economy-growth-2022-11662062706
39,2022-09-02,U.S.,"Republicans Mount Rescue Effort in Pennsylvania for Mastriano, Oz",https://www.wsj.com/articles/republicans-mount-rescue-effort-in-pennsylvania-for-mastriano-oz-campaigns-11662131864
40,2022-09-02,U.S. Economy,Wage Gains Ease as More Americans Join the Labor Force ,https://www.wsj.com/articles/wage-gains-ease-as-more-americans-join-the-labor-force-11662145777
41,2022-09-02,World,Ukraine Accuses Russia of Hindering Access to Zaporizhzhia Nuclear Plant,https://www.wsj.com/articles/ukraine-accuses-russia-of-hindering-access-to-zaporizhzhia-nuclear-plant-11662116143
42,2022-09-02,U.S.,IRS Exposed Some Confidential Taxpayer Data on Website ,https://www.wsj.com/articles/irs-says-it-exposed-some-confidential-taxpayer-data-on-website-11662145232
43,2022-09-02,U.S.,Court Releases Detailed FBI Inventory of Material Seized at Mar-a-Lago,https://www.wsj.com/articles/detailed-inventory-released-of-material-seized-at-trumps-mar-a-lago-11662129221
44,2022-09-02,Off Duty Travel,The Hardest Part of a Family Vacation? Deciding Where to Go,https://www.wsj.com/articles/vacation-itinerary-costa-rica-belize-jamaica-family-trip-11662141568
45,2022-09-02,Politics,Biden Picks John Podesta as New Domestic Clean Energy Adviser,https://www.wsj.com/articles/white-house-s-top-domestic-climate-adviser-to-leave-11662137583
46,2022-09-02,Bookshelf,13 Books We Read This Week,https://www.wsj.com/articles/13-books-we-read-this-week-reviews-history-memoir-fiction-politics-law-mystery-children-11662142123
47,2022-09-02,Science,NASA Poised for Second Artemis Launch Attempt Saturday,https://www.wsj.com/articles/nasa-poised-for-second-artemis-launch-attempt-saturday-11662142579
48,2022-09-02,Fashion,Still Dressing Like It’s 2020? You Need This Guide.  ,https://www.wsj.com/articles/fashion-trends-fall-2022-mens-style-womens-style-11662142416
49,2022-09-02,Best of the Web,Pennsylvania’s Absentee Senate Candidate,https://www.wsj.com/articles/pennsylvanias-absentee-candidate-11662142151
50,2022-09-02,Icons,A Museum Renewed,https://www.wsj.com/articles/a-museum-renewed-11662141211
51,2022-09-02,Business,Ford’s U.S. Sales Rose 27% in August on Strong EV Demand,https://www.wsj.com/articles/fords-u-s-sales-rise-27-in-august-on-strong-ev-demand-11662139266
52,2022-09-02,Europe,ArcelorMittal to Close Two Steel Plants Amid European Energy Crisis ,https://www.wsj.com/articles/arcelormittal-closes-two-steel-plants-amid-european-energy-crisis-11662136823
53,2022-09-02,Law,Law Firms Jockey to Help Companies Manage Diversity and Equity,https://www.wsj.com/articles/law-firms-jockey-to-help-companies-manage-diversity-and-equity-11662136442
54,2022-09-02,Weekend Confidential,Pastor Timothy Keller Speaks to the Head and the Heart,https://www.wsj.com/articles/pastor-timothy-keller-speaks-to-the-head-and-the-heart-11662136046
55,2022-09-02,Travel,Your Flight Is Canceled. See What Each Airline Should Offer You.,https://www.wsj.com/articles/your-flight-is-canceled-see-what-each-airline-is-supposed-to-offer-you-11662068287
56,2022-09-02,Soccer,Chelsea Lost Its Oligarch—and Spent Even More Money,https://www.wsj.com/articles/chelsea-owner-todd-boehly-transfer-window-raheem-sterling-11662135813
57,2022-09-02,World,Russian Oil Faces Price Cap Under New G-7 Plan,https://www.wsj.com/articles/g-7-rolls-out-plan-to-cap-price-of-russian-oil-11662124852
58,2022-09-02,Journal Reports: Personal Investing,When a Mutual-Fund Converts to an ETF: How It Works,https://www.wsj.com/articles/mutual-fund-etf-conversion-taxes-11662062453
59,2022-09-02,U.S.,Jackson Water Crisis Forces Cities to Confront Their Own Aging Infrastructure,https://www.wsj.com/articles/jackson-water-crisis-aging-infrastructure-11662132216
60,2022-09-02,Business,Shell CEO van Beurden Prepares Exit After Nine Years in Role ,https://www.wsj.com/articles/shell-ceo-prepares-exit-after-nine-years-in-role-11662125448
61,2022-09-02,Heard on the Street,The Job Market Fights the Fed,https://www.wsj.com/articles/the-job-market-fights-the-fed-11662132464
62,2022-09-02,Bookshelf,‘Worse Than Nothing’ Review: What Originalism Is and Isn’t,https://www.wsj.com/articles/worse-than-nothing-book-review-what-originalism-is-and-isnt-11662132343
63,2022-09-02,Business,Starbucks Names Reckitt’s Chief as Its New CEO,https://www.wsj.com/articles/starbucks-names-laxman-narasimhan-new-ceo-11662062713
64,2022-09-02,Bookshelf,‘Shy’ Review: A Broadway Princess With a Song of Her Own,https://www.wsj.com/articles/shy-book-review-mary-rodgers-a-broadway-princess-with-a-song-of-her-own-11662131400
65,2022-09-02,Asia,China’s Pinduoduo Quietly Launches U.S. E-Commerce Site Temu ,https://www.wsj.com/articles/chinas-pinduoduo-quietly-launches-u-s-e-commerce-site-temu-11662131454
66,2022-09-02,◆,WSJ News Exclusive,https://www.wsj.com/articles/gm-to-offer-franchise-buyouts-to-u-s-buick-dealers-11662129950
67,2022-09-02,Bookshelf,Fiction: ‘The Unfolding’ and ‘The Marriage Portrait’,https://www.wsj.com/articles/fiction-book-review-a-m-homes-the-unfolding-maggie-ofarrell-the-marriage-portrait-11662131090
68,2022-09-02,Essay,The Two Faces of China’s Surveillance State,https://www.wsj.com/articles/the-two-faces-of-chinas-surveillance-state-11662130940
69,2022-09-02,Bookshelf,Five Best: Literary Breakdowns,https://www.wsj.com/articles/five-best-books-literary-breakdowns-11662130785
70,2022-09-02,The Intelligent Investor,The Stock Market’s Real Inflation Fighters Might Surprise You,https://www.wsj.com/articles/stock-market-inflation-best-performance-11662130645
71,2022-09-02,Bookshelf,‘A Continent Erupts’ Review: A Decade of Violence in Asia,https://www.wsj.com/articles/a-continent-erupts-book-review-history-a-decade-of-violence-in-asia-11662130240
72,2022-09-02,U.S. Economy,Jobs Report Keeps Fed on Track for Another Rate Rise,https://www.wsj.com/articles/steady-labor-market-keeps-fed-on-track-for-another-rate-rise-11662130400
73,2022-09-02,Asia,Former U.K. Ambassador Sentenced to Prison in Myanmar,https://www.wsj.com/articles/former-u-k-ambassador-vicky-bowman-sentenced-to-prison-in-myanmar-for-address-mismatch-11662130381
74,2022-09-02,China,"China’s Economy Won’t Overtake the U.S., Some Now Predict",https://www.wsj.com/articles/will-chinas-economy-surpass-the-u-s-s-some-now-doubt-it-11662123945
75,2022-09-02,Letters,A Better Way for College Education,https://www.wsj.com/articles/uatx-university-austin-woke-college-tuition-student-loan-education-department-11662065828
76,2022-09-02,Letters,Adults Used to Understand When Not to Listen to Kids,https://www.wsj.com/articles/trans-gender-transition-children-kids-tomboy-girl-pediatrics-mother-aap-genspect-11662065106
77,2022-09-02,Letters,Regulation Debate Misses the Point of Crypto,https://www.wsj.com/articles/crypto-currency-blockchain-bank-regulation-11662065526
78,2022-09-02,Bookshelf,‘Natural History’ Review: Doing the Experiment,https://www.wsj.com/articles/natural-history-book-review-fiction-andrea-barrett-doing-the-experiment-11662129665
79,2022-09-02,Letters,"SALT-Cap Repeal Is Pushed for the Few, Not the Many",https://www.wsj.com/articles/salt-cap-tax-deduction-repeal-state-local-11662089862
80,2022-09-02,Letters,Holman Jenkins Should Make His Case for a Carbon Tax,https://www.wsj.com/articles/holman-jenkins-carbon-tax-climate-change-revenue-neutral-wsj-11662064598
81,2022-09-02,Bookshelf,‘Nomads’ Review: Ancestors On the Move,https://www.wsj.com/articles/nomads-book-review-history-ancestors-on-the-move-11662129363
82,2022-09-02,Letters,History Takes a Wrong Turn,https://www.wsj.com/articles/history-writing-politics-presentism-subjectivity-bias-11662064416
83,2022-09-02,Latin America,Argentina’s Kirchner Unhurt After Gunman Pulled Trigger at Her Face,https://www.wsj.com/articles/argentina-vice-president-cristina-kirchner-is-unharmed-after-assassination-attempt-11662091597
84,2022-09-02,The Future of Everything | Health,How Brain-Computer Interfaces Could Restore Speech and Help Fight Depression ,https://www.wsj.com/articles/how-brain-computer-interfaces-could-restore-speech-and-help-fight-depression-11662129229
85,2022-09-02,Bookshelf,Mysteries: Robert Galbraith’s ‘The Ink Black Heart’,https://www.wsj.com/articles/mysteries-book-review-robert-galbraiths-the-ink-black-heart-j-k-rowling-cormoran-strike-11662128947
86,2022-09-02,Bookshelf,‘Mid-Air’ Review: Fortunes Falling and Rising,https://www.wsj.com/articles/mid-air-book-review-fiction-victoria-shorr-fortunes-falling-and-rising-11662128512
87,2022-09-02,Bookshelf,"Children’s Books: A Quest for Fire, A Fight for Freedom",https://www.wsj.com/articles/childrens-books-reviews-a-quest-for-fire-a-fight-for-freedom-11662128406
88,2022-09-02,World,"For Some Ukrainians, Fear of Homelessness Outweighs Fear of Death",https://www.wsj.com/articles/for-some-ukrainians-fear-of-homelessness-outweighs-fear-of-death-11662128190
89,2022-09-02,Journal Reports: Personal Investing,Which Investments Do Best—and Worst—in a Recession,https://www.wsj.com/articles/recessions-investments-best-worst-performers-11662061934
90,2022-09-02,Obituary,John Boll Built Largest U.S. Chain of Mobile-Home Parks,https://www.wsj.com/articles/john-boll-built-largest-u-s-chain-of-mobile-home-parks-11662127220
91,2022-09-02,Jason Gay,The Downside of Human Immortality,https://www.wsj.com/articles/the-downside-of-human-immortality-11662127182
92,2022-09-02,The A-hed,How Bags of Fiberglass Help Billie Eilish Sound Better,https://www.wsj.com/articles/how-bags-of-fiberglass-help-billie-eilish-sound-better-11662126411
93,2022-09-02,Heard on the Street,Emerging-Market Currencies Face Different Degrees of Pain,https://www.wsj.com/articles/emerging-market-currencies-face-different-degrees-of-pain-11662125927
94,2022-09-02,Midterm Election 2022,"Biden Says Trump, Allies Threaten Democracy ",https://www.wsj.com/articles/biden-to-say-in-prime-time-address-democracy-is-at-stake-in-midterm-elections-11662048825
95,2022-09-02,◆,WSJ News Exclusive,https://www.wsj.com/articles/hong-kong-floats-quarantine-free-plan-for-financial-summit-but-bankers-dont-want-exceptions-11662124361
96,2022-09-02,Russia,"Russia Committed Potential War Crimes With Forcible Transfers,  Group Says",https://www.wsj.com/articles/russia-committed-potential-crimes-against-humanity-with-forcible-transfers-rights-group-says-11662048942
97,2022-09-02,Business,Record Turkey Prices Are Coming for Thanksgiving,https://www.wsj.com/articles/record-turkey-prices-could-make-for-a-fowl-thanksgiving-11662117778
98,2022-09-02,Finance,"Biden Student Debt Plan Would Send More to Wealthier Families, JPMorgan Data Shows",https://www.wsj.com/articles/biden-student-debt-plan-would-send-more-to-richer-families-jpmorgan-data-shows-11662086422
99,2022-09-02,Logistics Report,Retailers Start Selling Something New: Logistics Services ,https://www.wsj.com/articles/retailers-start-selling-something-new-logistics-services-11662112980
100,2022-09-02,Slideshow,A Closer Look,https://www.wsj.com/articles/a-closer-look-11662112801
101,2022-09-02,Slideshow,A Closer Look,https://www.wsj.com/articles/a-closer-look-11662112800
102,2022-09-02,Slideshow,A Closer Look,https://www.wsj.com/articles/a-closer-look-11662112800
103,2022-09-02,Heard on the Street,One Stream Won’t Rule Them All,https://www.wsj.com/articles/streaming-amazon-lord-of-the-rings-netflix-disney-11662064745
104,2022-09-02,The Numbers | Josh Zumbrun,Russian Economic Optimism Is Based on Suspect Data,https://www.wsj.com/articles/russian-economic-optimism-is-based-on-suspect-data-11662111002
105,2022-09-02,CFO Journal,New Duke Energy CFO Steps Into Role as Utility Considers Sale of Renewables Business,https://www.wsj.com/articles/new-duke-energy-cfo-steps-into-role-as-utility-considers-sale-of-renewables-business-11662111000
106,2022-09-02,World,Nuclear Power’s Rebound Causes Rift Among Environmentalists ,https://www.wsj.com/articles/nuclear-powers-rebound-causes-rift-among-environmentalists-11662111001
107,2022-09-02,Tax Report,Win an Income-Tax Trifecta With Charitable Donations,https://www.wsj.com/articles/leave-ira-money-to-charity-donation-death-bequest-daf-11662073502
108,2022-09-02,Finance,Rising Mortgage Rates Complicate Decision on Buying Versus Renting,https://www.wsj.com/articles/rising-mortgage-rates-complicate-decision-on-buying-versus-renting-11662065322
109,2022-09-02,Travel,Travel Disruption Expected Over Labor Day Weekend,https://www.wsj.com/articles/labor-day-travel-expect-busier-airports-more-traffic-this-year-11662063171
110,2022-09-02,Asia,Compromise Lies Behind Singapore’s New Approach to LGBT Rights    ,https://www.wsj.com/articles/compromise-lies-behind-singapores-new-approach-to-lgbt-rights-11662110698
111,2022-09-02,World,Ukraine Says Russia Uses Cargo Ships to Ferry Weapons to Black Sea,https://www.wsj.com/articles/ukraine-says-russia-is-using-cargo-ships-to-ferry-weapons-to-the-black-sea-11662065663
112,2022-09-02,Foreign Exchange,Fed’s Aggressive Stance Pushes Yen to 24-Year Low Against Dollar,https://www.wsj.com/articles/feds-aggressive-stance-pushes-yen-to-24-year-low-against-dollar-11662094233
113,2022-09-02,Pepper & Salt,Pepper...and Salt,https://www.wsj.com/articles/pepper-and-salt-11662091219
114,2022-09-03,U.S.,"NASA to Analyze Moon Rocket Fuel Leak, Further Pushing Back Launch",https://www.wsj.com/articles/nasa-tries-again-to-launch-artemis-i-moon-mission-11662202531
115,2022-09-03,Media & Marketing,"Yes, You Can Go See a Movie for $3",https://www.wsj.com/articles/yes-you-can-go-see-a-movie-for-3-11662157693
116,2022-09-03,Europe,"European Governments, Companies Gird for Higher Gas Prices",https://www.wsj.com/articles/european-governments-companies-gird-for-higher-prices-after-russia-gas-cutoff-11662236153
117,2022-09-03,World,Ukraine Claims Drone Strikes Destroyed Russian Military Equipment,https://www.wsj.com/articles/ukraine-backs-plan-to-cap-russian-oil-prices-11662209104
118,2022-09-03,U.S.,Mississippi Pilot Who Threatened to Crash Into a Walmart Is Arrested ,https://www.wsj.com/articles/pilot-circling-in-north-mississippi-threatening-to-crash-into-a-walmart-11662218518
119,2022-09-03,U.S.,"California Wildfires Spread, Blackout Concerns Mount Over Weekend",https://www.wsj.com/articles/california-heat-wave-sparks-wildfires-blackout-concerns-11662224821
120,2022-09-03,World,"Mikhail Gorbachev, the Last Leader of the U.S.S.R., Laid to Rest    ",https://www.wsj.com/articles/mikhail-gorbachev-the-first-and-last-president-of-the-u-s-s-r-laid-to-rest-11662210058
121,2022-09-03,Asia,"Gotabaya Rajapaksa, Sri Lanka’s Ousted President, Returns as Nation Secures IMF Rescue",https://www.wsj.com/articles/sri-lankas-ousted-president-gotabaya-rajapaksa-returns-as-country-secures-imf-rescue-11662223111
122,2022-09-03,Autos Industry,Porsche Family to Acquire More Than 25% of the Car Maker as IPO Nears,https://www.wsj.com/articles/porsche-heirs-agree-to-acquire-more-than-25-of-the-sports-car-maker-in-ipo-11662198444
123,2022-09-03,Journal Reports: Personal Investing,"If You Withdrew Money From Your IRA During Covid, It Can Pay to Repay It",https://www.wsj.com/articles/ira-withdrawal-covid-repayment-taxes-11662145948
124,2022-09-03,The Future of Everything | Health,Finding New Drugs From the Deep Sea via ‘eDNA’,https://www.wsj.com/articles/finding-new-drugs-from-the-deep-sea-via-edna-11662216510
125,2022-09-03,My Ride,He Travels Back to 1979 With Each Ride in His Mercedes,https://www.wsj.com/articles/he-travels-back-to-1979-with-each-ride-in-his-mercedes-11662210156
126,2022-09-03,Streetwise,The Other Doomsday Scenario Looming Over Markets,https://www.wsj.com/articles/the-other-doomsday-scenario-looming-over-markets-11662212004
127,2022-09-03,Heard on the Street,EU’s Energy Plan Beats Inaction,https://www.wsj.com/articles/eus-energy-plan-beats-inaction-11662196551
128,2022-09-03,Finance,"UBS, Wealthfront Terminate Their Planned Merger",https://www.wsj.com/articles/ubs-wealthfront-agree-to-terminate-planned-merger-11662152563
129,2022-09-03,Politics,"Support for Legalized Abortion Grows Since Dobbs Ruling, WSJ Poll Shows ",https://www.wsj.com/articles/support-for-legalized-abortion-grows-since-dobbs-ruling-wsj-poll-shows-11662210020
130,2022-09-03,Family & Tech: Julie Jargon,The Hacks Kids Use to Bypass Apple Parental Controls,https://www.wsj.com/articles/the-ipad-and-iphone-hacks-kids-use-to-sneak-past-parental-controls-11662173311
131,2022-09-03,Travel,Running a Resort This Summer Was No Vacation,https://www.wsj.com/articles/running-a-maine-resort-this-summer-was-no-vacation-11662177616
132,2022-09-03,Asia,"Shenzhen Tells Most Residents to Stay Home, as Covid-19 Controls Tighten Across China",https://www.wsj.com/articles/shenzhen-tells-most-residents-to-stay-home-as-covid-19-controls-tighten-across-china-11662206794
133,2022-09-03,Asia,Chinese E-Commerce Companies Suffer as Economy Sours ,https://www.wsj.com/articles/chinese-e-commerce-companies-suffer-as-economy-sours-11662206580
134,2022-09-03,Style,The Latest CEO Flex? Washboard Abs,https://www.wsj.com/articles/ceo-workout-abs-bezos-musk-11662166439
135,2022-09-03,World,Ukraine Sees Many Ways to Hurt Russia in Kherson Offensive,https://www.wsj.com/articles/ukraine-sees-many-ways-to-hurt-russia-in-kherson-offensive-11662203459
136,2022-09-03,Latin America,Chileans Wary as They Vote for New Constitution That Would Upend Free Market Model,https://www.wsj.com/articles/chilean-voters-are-likely-to-reject-constitution-overhauling-economy-11662202801
137,2022-09-03,U.S.,It’s Not Looking Good for the Baltimore Ravens Mascot After ‘Serious Injury to His Drumstick’,https://www.wsj.com/articles/its-not-looking-good-for-the-baltimore-ravens-mascot-after-serious-injury-to-his-drumstick-11662153561
138,2022-09-03,Anatomy of a Workout,"This Wheelchair Tennis Champ Excels at These Exercises. You Can, Too.",https://www.wsj.com/articles/wheelchair-tennis-us-open-workout-11662061915
139,2022-09-03,◆,WSJ News Exclusive,https://www.wsj.com/articles/citigroup-joins-industry-effort-to-lend-to-people-without-credit-scores-11662174186
140,2022-09-03,Property Report,Affordable-Housing Projects Derailed as Developers Struggle for Financing ,https://www.wsj.com/articles/affordable-housing-projects-derailed-as-developers-struggle-for-financing-11662197401
141,2022-09-03,Midterm Election 2022,Midterm Elections to Decide Fate of Biden’s Tax Agenda,https://www.wsj.com/articles/midterm-elections-to-decide-fate-of-bidens-tax-agenda-11662157721
142,2022-09-03,Essay,Two Philosophers Found Purpose in the World of Work,https://www.wsj.com/articles/two-philosophers-found-purpose-in-the-world-of-work-11662177661
