,date,subject,headline,headline_link
143,2022-09-03,Table Talk,The Year-Round Pleasures of Outdoor Meals,https://www.wsj.com/articles/the-year-round-pleasures-of-outdoor-meals-11662177660
144,2022-09-03,Pepper & Salt,Pepper...and Salt,https://www.wsj.com/articles/pepper-and-salt-11662177637
145,2022-09-03,Business,"It Really Is Time to Get Back to the Office, Bosses Say*",https://www.wsj.com/articles/back-to-the-office-hybrid-work-remote-labor-day-11662151436
146,2022-09-03,Design,"On a Trip to the Alhambra, Reveling in Regal Moorish Design",https://www.wsj.com/articles/interior-design-alhambra-regal-moorish-11662155714
147,2022-09-03,Business,A Boss Ordered All Workers Back to the Office a Year Ago. He Has No Regrets.,https://www.wsj.com/articles/a-boss-ordered-all-workers-back-to-the-office-a-year-ago-he-has-no-regrets-11662177637
148,2022-09-04,Canada,"Ten Dead, 15 Injured in Western Canada Stabbing Attacks ",https://www.wsj.com/articles/ten-dead-15-injured-in-western-canada-stabbing-attacks-11662334130
149,2022-09-04,Latin America,"Voters in Chile Reject a Constitution Targeting Economy, Indigenous Rights",https://www.wsj.com/articles/voters-in-chile-overwhelmingly-reject-a-draft-constitution-11662336970
150,2022-09-04,Business,Bed Bath & Beyond Says CFO Gustavo Arnal Found Dead,https://www.wsj.com/articles/bed-bath-beyond-confirms-death-of-cfo-gustavo-arnal-11662310176
151,2022-09-04,U.S.,"Las Vegas Reporter Found Dead, Stabbed Outside Home",https://www.wsj.com/articles/las-vegas-reporter-found-dead-stabbed-outside-home-11662326394
152,2022-09-04,Europe,"Ukraine’s Zelensky Hails Small Advances in South, East",https://www.wsj.com/articles/ukraines-zelensky-rallies-europe-against-russias-energy-attack-after-gas-cutoff-11662287651
153,2022-09-04,◆,WSJ News Exclusive,https://www.wsj.com/articles/russia-signals-opposition-to-opec-oil-production-cut-11662296032
154,2022-09-04,Letters,Randi Weingarten Responds on Pandemic School Closures,https://www.wsj.com/articles/randi-weingarten-teachers-union-aft-pandemic-school-closure-reopening-11662151464
155,2022-09-04,Economy Week Ahead,Economy Week Ahead: U.S. Trade and European Central Bank in Focus ,https://www.wsj.com/articles/economy-week-ahead-u-s-trade-and-european-central-bank-in-focus-11662318001
156,2022-09-04,Midterm Election 2022,Trump Criticizes FBI Search During Pennsylvania Midterm Election Rally ,https://www.wsj.com/articles/trump-criticizes-fbi-search-during-pennsylvania-midterm-election-rally-11662313338
157,2022-09-04,Journal Reports: Personal Investing,How to Handle Required Withdrawals From Retirement Accounts,https://www.wsj.com/articles/ira-withdrawals-rmd-tips-11662146809
158,2022-09-04,Middle East,Israel Makes Final Push to Shape Restored Iran Nuclear Deal ,https://www.wsj.com/articles/israel-makes-final-push-to-shape-restored-iran-nuclear-deal-11662304411
159,2022-09-04,The Future of Everything | Health,A Spark of Life After Death Points to New Hope for Blindness,https://www.wsj.com/articles/a-spark-of-life-after-death-points-to-new-hope-for-blindness-11662303872
160,2022-09-04,Journal Reports: Personal Investing,U.S.-Stock Funds Are Down 17.3% So Far in 2022,https://www.wsj.com/articles/u-s-stock-funds-down-17-3-in-2022-11662146408
161,2022-09-04,Business,Inflation Tests Tide Maker’s Laundry-Detergent Dominance ,https://www.wsj.com/articles/inflation-tests-tide-makers-laundry-detergent-dominance-11662300001
162,2022-09-04,Heard on the Street,Profit From America’s Healthcare Bloat ,https://www.wsj.com/articles/profit-from-americas-healthcare-bloat-11662300000
163,2022-09-04,Health & Wellness,The Rise of the Menopause Vacation,https://www.wsj.com/articles/the-rise-of-the-menopause-vacation-11662240398
164,2022-09-04,Review & Outlook,All About Nikki Haley’s Donors,https://www.wsj.com/articles/all-about-nikki-haleys-donors-new-york-attorney-general-letitia-james-stand-for-america-11662065044
165,2022-09-04,Commentary,The Left Gets Fascism Backward,https://www.wsj.com/articles/bidens-speech-had-it-all-backward-fascist-democratic-party-trump-ideology-america-jan-6-democracy-11662161065
166,2022-09-04,Life Science,Look Who’s Rushing Covid Vaccines Now,https://www.wsj.com/articles/rushing-covid-vaccines-bivalent-pfizer-moderna-risk-harm-sickness-shots-pandemic-fda-skeptics-11662149144
167,2022-09-04,The Outlook,A Slowing China Helps Rein In Inflation Around the World,https://www.wsj.com/articles/a-slowing-china-helps-rein-in-inflation-around-the-world-11662296400
168,2022-09-04,Business,Music Festivals Hit Harder Times in Crowded Concert Market,https://www.wsj.com/articles/music-festivals-hit-harder-times-in-crowded-concert-market-11662296401
169,2022-09-04,India,India Takes Cautious Steps Toward Ties With Taliban,https://www.wsj.com/articles/india-takes-cautious-steps-toward-ties-with-taliban-11662296400
170,2022-09-04,◆,WSJ News Exclusive,https://www.wsj.com/articles/europes-energy-crunch-squeezes-worlds-largest-particle-collider-11662294416
171,2022-09-04,Logistics Report,Willie Adams Steers Union Through Port Labor Negotiations ,https://www.wsj.com/articles/union-chief-willie-adams-steers-a-tough-course-through-port-labor-negotiations-11662292801
172,2022-09-04,U.S. Economy,Consumers Feel Worse Now Than They Did During Covid Lockdowns,https://www.wsj.com/articles/consumers-feel-worse-now-than-they-did-during-covid-lockdowns-11662292800
173,2022-09-04,Personal Tech | Nicole Nguyen ,"Share Your Location With Loved Ones, Not Big Tech",https://www.wsj.com/articles/how-to-share-your-smartphone-location-with-loved-onesnot-big-tech-11662234935
174,2022-09-04,Europe,"Germany Agrees on Gas Relief Package for Businesses, Consumers",https://www.wsj.com/articles/germany-agrees-gas-relief-package-for-businesses-consumers-11662290838
175,2022-09-04,China,China’s Economic Slump Bodes Ill for Birth Numbers ,https://www.wsj.com/articles/chinas-economic-slump-bodes-ill-for-birth-numbers-11662289200
176,2022-09-04,Politics,Senators Return to Work for Final Legislative Push Before Midterms ,https://www.wsj.com/articles/lawmakers-plan-to-confirm-more-judges-in-first-actions-after-summer-break-11662240700
177,2022-09-04,Middle East,Saudi Arabia Is Betting $1 Trillion It Can Become the Next Tourist Hotspot,https://www.wsj.com/articles/saudi-arabia-is-betting-1-trillion-it-can-become-the-next-tourist-hotspot-11662283802
178,2022-09-04,U.S.,"Back-to-School Week in Uvalde, Texas, Brings Decisions—and Fear",https://www.wsj.com/articles/back-to-school-week-in-uvalde-texas-brings-decisions-fear-11662283802
179,2022-09-04,Politics,Federal Oil Leases Slow to a Trickle Under Biden,https://www.wsj.com/articles/federal-oil-leases-slow-to-a-trickle-under-biden-11662230816
180,2022-09-04,Finance,Inflation’s Silver Lining: Making Money on Your Savings,https://www.wsj.com/articles/inflations-silver-lining-you-can-make-money-on-your-savings-again-11662234124
181,2022-09-04,World,Pope Francis Beatifies His Predecessor Pope John Paul I,https://www.wsj.com/articles/pope-francis-beatifies-his-predecessor-pope-john-paul-i-11662282755
182,2022-09-05,Europe,Ukraine Says Russian Shelling Disconnects Zaporizhzhia Nuclear Plant From Grid,https://www.wsj.com/articles/ukraine-faces-energy-blackouts-as-its-forces-press-on-in-south-east-11662378738
183,2022-09-05,Review & Outlook,Chile Saves Its Democracy,https://www.wsj.com/articles/chile-saves-its-democracy-constitution-vote-gabriel-boric-11662416111
184,2022-09-05,Canada,One Suspect in Canada Stabbing Spree Found Dead ,https://www.wsj.com/articles/canada-police-file-charges-issue-arrest-warrants-for-two-men-after-saskatchewan-stabbing-attacks-11662404462
185,2022-09-05,Tennis,American Frances Tiafoe Upsets Rafael Nadal at U.S. Open,https://www.wsj.com/articles/frances-tiafoe-rafa-nadal-us-open-11662417080
186,2022-09-05,U.S.,Coast Guard Calls Off Search for Nine Missing After Seaplane Crash Near Seattle,https://www.wsj.com/articles/one-dead-nine-missing-after-float-plane-crashes-near-seattle-11662393584
187,2022-09-05,Latin America,Chile’s President Pivots to Centrist Approach,https://www.wsj.com/articles/chiles-president-pivots-to-more-centrist-approach-11662416369
188,2022-09-05,Review & Outlook,"The Water Woes of Jackson, Miss., Explained",https://www.wsj.com/articles/jacksons-water-woes-explained-mississippi-water-crisis-tate-reeves-chokwe-lumumba-11662414993
189,2022-09-05,Review & Outlook,Herbert V. Kohler Jr. ,https://www.wsj.com/articles/herbert-v-kohler-jr-kohler-co-wisconsin-golf-family-business-whistling-straits-11662404383
190,2022-09-05,Review & Outlook,Liz Truss to the British Rescue,https://www.wsj.com/articles/liz-truss-to-the-british-rescue-u-k-prime-minister-boris-johnson-election-economy-conservative-party-11662388952
191,2022-09-05,Main Street,Biden Is Angry but Not Serious,https://www.wsj.com/articles/joe-bidens-sound-and-fury-speech-philadelphia-trump-maga-anger-president-partisan-democracy-white-house-address-11662401459
192,2022-09-05,Global View,A Century of U.S.-Israel Ties,https://www.wsj.com/articles/a-century-of-u-s-israel-ties-palestine-america-lodge-fish-resolution-zionism-immigration-restriction-homeland-support-11662401719
193,2022-09-05,Bookshelf,‘Happier Hour’ Review: Of Time and Happiness,https://www.wsj.com/articles/happier-hour-review-of-time-and-happiness-11662414839
194,2022-09-05,Commentary,Inflation Catches the Pentagon Flat-Footed,https://www.wsj.com/articles/inflation-catches-the-pentagon-flat-footed-army-paychecks-food-stamps-defense-department-budget-ppi-troops-11662405897
195,2022-09-05,Commentary,Invest in the Future of Ukraine,https://www.wsj.com/articles/invest-in-the-future-of-ukraine-volodymyr-zelensky-stem-graduates-business-technology-sector-billions-partnerships-11662404585
196,2022-09-05,Cross Country,California’s Latest Gift to Big Labor ,https://www.wsj.com/articles/california-latest-gift-to-big-labor-law-tax-credit-newsom-unions-janus-11662401701
197,2022-09-05,The A-Hed,Sheep Are the Solar Industry’s Lawn Mowers of Choice,https://www.wsj.com/articles/sheep-solar-industry-panel-fields-11662390795
198,2022-09-05,◆,WSJ News Exclusive,https://www.wsj.com/articles/ernst-young-leaders-expected-to-approve-plan-to-split-accounting-company-11662404933
199,2022-09-05,Heard on the Street,OPEC+’s Warning Shot ,https://www.wsj.com/articles/opec-s-warning-shot-11662390617
200,2022-09-05,Deals,CVS Announces Deal to Acquire Home-Healthcare Company Signify ,https://www.wsj.com/articles/cvs-announces-deal-to-acquire-home-healthcare-company-signify-11662411855
201,2022-09-05,National Security,Judge Grants Trump Request for Independent Review of Mar-a-Lago Documents,https://www.wsj.com/articles/judge-partly-grants-donald-trumps-request-for-independent-review-of-mar-a-lago-documents-11662395427
202,2022-09-05,Politics,What is Executive Privilege? ,https://www.wsj.com/articles/what-is-executive-privilege-11662408374
203,2022-09-05,U.S.,"California Governor Signs Fast Food Bill, Opening Way to Higher Wages",https://www.wsj.com/articles/fast-food-wages-could-increase-to-22-an-hour-in-california-11662398251
204,2022-09-05,World,Explosion Outside Russian Embassy in Kabul Kills Two Staff,https://www.wsj.com/articles/explosion-outside-russian-embassy-in-kabul-kills-two-staff-11662401946
205,2022-09-05,Midterm Election 2022,Biden’s Climate-Bill Win Offers Fresh Chance to Woo Midterm Voters,https://www.wsj.com/articles/bidens-climate-bill-win-offers-fresh-chance-to-woo-midterm-voters-11662370200
206,2022-09-05,Oil Markets,OPEC+ Agrees to Small Production Cut Amid Recession Fears ,https://www.wsj.com/articles/opec-agrees-to-small-production-cut-amid-recession-fears-11662381781
207,2022-09-05,Business,"California Blackout Risks Intensify Amid Soaring Temperatures, Wildfires ",https://www.wsj.com/articles/california-blackout-risks-intensify-amid-soaring-temperatures-wildfires-11662404359
208,2022-09-05,Gas Markets,Nord Stream Pipeline Closure Lands Blow Against Europe ,https://www.wsj.com/articles/russias-nord-stream-pipeline-closure-lands-economic-blow-against-europe-11662388752
209,2022-09-05,Russia,Russia Court Sentences Former Journalist and Space-Agency Aide for High Treason,https://www.wsj.com/articles/russia-court-sentences-former-journalist-and-space-agency-aide-for-high-treason-11662400426
210,2022-09-05,Europe,Germany to Delay Closure of Two Nuclear Plants Amid Russian Gas Cuts,https://www.wsj.com/articles/germany-to-delay-closure-of-two-nuclear-power-plants-as-energy-crisis-bites-11662400161
211,2022-09-05,Tech,Instagram Fined $402 Million in EU for Allegedly Mishandling Children’s Data,https://www.wsj.com/articles/instagram-fined-402-million-in-eu-for-allegations-of-mishandling-childrens-data-11662398050
212,2022-09-05,U.S. Markets,European Stocks Slip as Key Russian Gas Pipeline to Remain Closed ,https://www.wsj.com/articles/global-stocks-markets-dow-update-09-05-2022-11662370922
213,2022-09-05,Commentary,A Law-and-Order Leader for Oregon,https://www.wsj.com/articles/law-and-order-leader-for-oregon-christine-drazan-larry-hogan-governor-police-funding-defund-officer-protection-crime-rates-11662387619
214,2022-09-05,Free Expression,Can Britain’s Conservatives Find Their Way Again?,https://www.wsj.com/articles/britain-conservatives-liz-truss-rishi-sunak-prime-minister-queen-balmoral-win-european-union-victory-low-taxes-energy-wokeness-11662388256
215,2022-09-05,Letters,Is This the Best That Government Can Do on Big Tech?,https://www.wsj.com/articles/big-tech-ftc-antitrust-competition-lina-khan-11662149493
216,2022-09-05,Letters,Homeowners Can Protect Themselves From Wildfires,https://www.wsj.com/articles/wildfire-california-west-home-owner-hardening-embers-forest-11662149139
217,2022-09-05,Letters,Income Inequality at the Top and Equality Down at the Bottom,https://www.wsj.com/articles/income-inequality-equality-top-bottom-quintile-distribution-benefits-11662148952
218,2022-09-05,MLB,Baseball’s Newest Must-Have Skill: Getting Drilled by Pitches,https://www.wsj.com/articles/mlb-hit-by-pitch-new-york-mets-atlanta-braves-11662390687
219,2022-09-05,Letters,The Consumer Is Still in Charge,https://www.wsj.com/articles/vanguard-esg-investing-financial-services-market-antitrust-break-up-11662148815
220,2022-09-05,Letters,"Mikhail Gorbachev, 20th-Century Hero",https://www.wsj.com/articles/mikhail-gorbachev-20th-century-hero-soviet-union-leader-death-11662148695
221,2022-09-05,Journal Reports: Personal Investing,Can the Stock Market End Up Positive for the Year?,https://www.wsj.com/articles/stock-market-end-2022-positive-11662168439
222,2022-09-05,U.K.,Liz Truss’s Inheritance: A U.K. Economy on Its Knees ,https://www.wsj.com/articles/liz-truss-uk-economy-recession-inflation-energy-crisis-11662388777
223,2022-09-05,U.K.,Truss to Succeed Johnson as U.K. Prime Minister,https://www.wsj.com/articles/liz-truss-uk-prime-minister-11662367474
224,2022-09-05,World,A Russian Soldier’s Inside View of Moscow’s War in Ukraine    ,https://www.wsj.com/articles/a-russiansoldiers-inside-view-of-moscows-war-in-ukraine-11662388999
225,2022-09-05,Europe,Trial Opens in France for Bastille Day Terrorist Attack in Nice,https://www.wsj.com/articles/trial-opens-in-france-for-bastille-day-terror-attack-in-nice-11662386096
226,2022-09-05,The Future of Everything | Health,A New Shot at Using Fish Oil,https://www.wsj.com/articles/a-new-shot-at-using-fish-oil-11662385576
227,2022-09-05,Heard on the Street,Chinese Blackouts Could Power Up Grid Stocks,https://www.wsj.com/articles/chinese-blackouts-could-power-up-grid-stocks-11662383906
228,2022-09-05,Africa,Kenyan Election Result Is Upheld by Supreme Court ,https://www.wsj.com/articles/kenyan-election-result-is-upheld-by-supreme-court-11662383312
229,2022-09-05,Journal Reports: Personal Investing,The Best Ways to Jump Into Dividend Stocks,https://www.wsj.com/articles/high-dividend-stocks-investments-tips-11662147049
230,2022-09-05,China,China’s Chengdu Extends Covid-19 Stay-Home Order as Restrictions Test Economy ,https://www.wsj.com/articles/chinas-chengdu-extends-covid-19-stay-home-order-as-restrictions-test-economy-11662382541
231,2022-09-05,Finance,China’s Central Bank Moves to Slow Yuan Depreciation ,https://www.wsj.com/articles/chinas-central-bank-moves-to-slow-yuan-depreciation-11662382433
232,2022-09-05,Markets,Pound Falls to Lowest Level Since 1985 ,https://www.wsj.com/articles/british-pound-falls-to-lowest-level-since-1985-as-u-k-economic-pain-mounts-11662327439
233,2022-09-05,Science,NASA Struggles With Familiar Problem on Artemis I: A Hydrogen Leak,https://www.wsj.com/articles/nasa-struggles-with-familiar-problem-on-artemis-i-a-hydrogen-leak-11662381000
234,2022-09-05,My Monday Morning,Thom Browne Can Envision an Entire Season in 5–10 Minutes,https://www.wsj.com/articles/wsjmagazine-com-thombrownemmm-11662129687
235,2022-09-05,CFO Journal,CFOs’ Right-Hand Executives Earn Bigger Paychecks as Companies Compete for Talent ,https://www.wsj.com/articles/cfos-right-hand-executives-earn-bigger-paychecks-as-companies-compete-for-talent-11662379205
236,2022-09-05,Tennis,Serena Williams Has Left the Building. Coco Gauff Wants to Take Over.,https://www.wsj.com/articles/coco-gauff-us-open-caroline-garcia-serena-williams-11662348218
237,2022-09-05,Business,Ocean Shipping Rates Have Plunged 60% This Year ,https://www.wsj.com/articles/ocean-shipping-rates-have-plunged-60-this-year-11662375780
238,2022-09-05,Consumer Technology,Apple’s Priciest iPhones Take Center Stage as Industry Smartphone Sales Decline ,https://www.wsj.com/articles/apples-priciest-iphones-take-center-stage-as-industry-smartphone-sales-decline-11662375601
239,2022-09-05,Economy,Now Is the Most Rewarding Time to Switch Jobs in Years,https://www.wsj.com/articles/now-is-most-rewarding-time-switch-jobs-pay-raise-11662163507
240,2022-09-05,Deals,U.K. Home Builder Vistry to Buy Rival Countryside for $1.4 Billion,https://www.wsj.com/articles/u-k-home-builders-countryside-partnerships-vistry-in-3-2-billion-merger-talks-11662328800
241,2022-09-05,Finance,Dollar Strength Lifts Americans’ Relative Spending Power,https://www.wsj.com/articles/u-s-dollar-strength-lifts-americans-relative-spending-power-11662304836
242,2022-09-05,Business,Next Wave of Nuclear-Power Plants Sees New Life in Climate Bill,https://www.wsj.com/articles/next-wave-of-nuclear-power-plants-sees-new-life-in-climate-bill-11662370381
243,2022-09-05,Politics,Biden’s Student-Debt-Forgiveness Plan May Cost Up to $1 Trillion,https://www.wsj.com/articles/bidens-student-debt-forgiveness-plan-may-cost-up-to-1-trillion-challenging-deficit-goals-11662370201
244,2022-09-05,U.S.,Many Migrants Left in Legal Limbo as U.S. Fails to File Cases,https://www.wsj.com/articles/many-migrants-left-in-legal-limbo-as-u-s-fails-to-file-cases-11662370201
245,2022-09-05,Turning Points,Caring for Family Doesn’t Have to Be Unpaid Work,https://www.wsj.com/articles/caring-for-family-doesnt-have-to-be-unpaid-work-11662316231
246,2022-09-05,Health,How Pfizer-BioNTech Modified Covid-19 Vaccines for Fall Boosters,https://www.wsj.com/articles/how-pfizer-and-biontech-modified-covid-19-vaccines-for-fall-boosters-11662341462
247,2022-09-05,Finance,Markets Struggle to Walk Tightrope With Focus on Fed,https://www.wsj.com/articles/markets-struggle-to-walk-tightrope-with-focus-on-fed-11662303486
248,2022-09-05,Music Review,‘When the Wind Forgets Your Name’ by Built to Spill Review: Still Indie After All These Years,https://www.wsj.com/articles/when-the-wind-forgets-your-name-built-to-spill-review-indie-rock-music-doug-martsch-11662154554
249,2022-09-05,Gas Markets,European Gas Prices Surge on Nord Stream Shutdown,https://www.wsj.com/articles/europe-girds-for-energy-market-turbulence-after-russian-gas-cut-11662323365
250,2022-09-05,China,Christian Church That Fled China Seeks Refugee Status From United Nations,https://www.wsj.com/articles/christian-church-that-fled-china-seeks-refugee-status-from-united-nations-11662359039
251,2022-09-06,Stocks,Investors Are Pouring Into U.S. Stocks,https://www.wsj.com/articles/investors-are-pouring-into-u-s-stocks-to-avoid-greater-turbulence-overseas-11662421967
252,2022-09-06,Tennis,Coco Gauff’s U.S. Open Run Ends with Defeat to Caroline Garcia,https://www.wsj.com/articles/coco-gauff-us-open-quarterfinal-caroline-garcia-11662511444
253,2022-09-06,Tech,"Musk, Twitter Trade Barbs at Wide-Ranging Hearing",https://www.wsj.com/articles/elon-musk-and-twitter-to-face-off-at-wide-ranging-hearing-11662476991
254,2022-09-06,World,Ukraine Seeks Corridor to Evacuate Civilians Near Zaporizhzhia Nuclear Plant,https://www.wsj.com/articles/ukraine-warns-of-risks-to-nuclear-plant-ahead-of-u-n-inspectors-report-11662456076
255,2022-09-06,Latin America,Chilean Centrists Are Added to Cabinet ,https://www.wsj.com/articles/chiles-president-adds-more-centrists-to-cabinet-after-new-constitution-rejected-11662504119
256,2022-09-06,CFO Journal,SEC Warns Chinese Companies About Risks of Auditor Changes,https://www.wsj.com/articles/sec-warns-chinese-companies-about-risks-of-auditor-changes-11662493564
257,2022-09-06,Review & Outlook,Walmart Takes On Lina Khan ,https://www.wsj.com/articles/walmart-takes-on-lina-khan-federal-trade-commission-lawsuit-11661967828
258,2022-09-06,Review & Outlook,Will Pennsylvania Get a Fetterman-Oz Debate?,https://www.wsj.com/articles/will-pa-get-a-john-fetterman-mehmet-oz-debate-pennsylvania-senate-race-11662501687
259,2022-09-06,Review & Outlook,Illumina and Antitrust’s Unholy Grail,https://www.wsj.com/articles/antitrust-laws-unholy-grail-illumina-european-commission-margrethe-vestager-11662499674
260,2022-09-06,Review & Outlook,Germany’s Nuclear Power Half-Step,https://www.wsj.com/articles/germanys-nuclear-half-step-nuclear-power-plant-energy-robert-habeck-vladimir-putin-europe-russia-11662470030
261,2022-09-06,Future View,Does Biden’s Student-Debt Forgiveness Help?,https://www.wsj.com/articles/does-bidens-student-debt-forgiveness-help-loans-debt-college-university-america-academics-higher-education-11662497045
262,2022-09-06,Commentary,ESG Can’t Square With Fiduciary Duty,https://www.wsj.com/articles/esg-cant-square-with-fiduciary-duty-blackrock-vanguard-state-stree-the-big-three-violations-china-conflict-of-interest-investors-11662496552
263,2022-09-06,Upward Mobility,Student-Loan Forgiveness Raises a Question About College,https://www.wsj.com/articles/student-debt-forgiveness-raises-a-basic-question-about-college-loans-forgiveness-biden-high-school-employment-rate-pay-back-graduation-11662496166
264,2022-09-06,Politics & Ideas,Owning Up to America’s Covid Pandemic Failures,https://www.wsj.com/articles/the-bruising-us-covid-response-life-expectancy-pandemic-education-reading-math-achievement-gap-sweden-menendez-collins-commission-11662482715
265,2022-09-06,Business World,Netflix’s Business Model Doesn’t Work,https://www.wsj.com/articles/netflix-doesnt-work-streaming-bundling-ads-warner-bros-at-t-hbo-max-merger-business-model-entertainment-11662496991
266,2022-09-06,Bookshelf,‘How to Invest’ Review: Masters of Money,https://www.wsj.com/articles/how-to-invest-review-masters-of-money-11662503193
267,2022-09-06,Notable & Quotable,Notable & Quotable: China,https://www.wsj.com/articles/notable-quotable-china-ccp-communist-party-gorbachev-soviet-union-russia-leadership-academic-study-power-11662494671
268,2022-09-06,Risk & Compliance Journal,Treasury Official Says Banks Can Help Curb Russia’s Oil Revenue,https://www.wsj.com/articles/treasury-official-says-financial-services-firms-can-help-curb-russias-oil-revenue-11662503075
269,2022-09-06,U.K.,Liz Truss Is Appointed U.K. Prime Minister ,https://www.wsj.com/articles/liz-truss-becomes-u-k-prime-minister-11662471933
270,2022-09-06,Business,Theranos Founder Elizabeth Holmes Seeks New Trial ,https://www.wsj.com/articles/theranos-founder-elizabeth-holmes-seeks-new-trial-citing-fresh-evidence-11662496376
271,2022-09-06,Business,Oil Royalty and Mineral Companies Sitio and Brigham to Merge in $4 Billion Tie-Up,https://www.wsj.com/articles/oil-royalty-and-mineral-companies-sitio-and-brigham-to-merge-in-4-billion-tie-up-11662460200
272,2022-09-06,◆,WSJ News Exclusive,https://www.wsj.com/articles/islamic-state-turns-to-nfts-to-spread-terror-message-11662292800
273,2022-09-06,◆,WSJ News Exclusive,https://www.wsj.com/articles/anti-esg-activist-investor-urges-chevron-to-increase-oil-production-11662494769
274,2022-09-06,U.S.,California Power Grid Faces Biggest Blackout Risk of Year as Heat Wave Intensifies,https://www.wsj.com/articles/california-faces-threat-of-rolling-blackouts-as-heat-wave-persists-11662473810
275,2022-09-06,U.S.,DOJ Considers Next Move After Judge Grants Trump’s Request for Special Master,https://www.wsj.com/articles/doj-considers-next-move-after-judge-greenlights-trumps-request-for-special-master-11662493448
276,2022-09-06,Business,Illumina’s Deal to Buy Cancer-Test Developer Is Blocked by the EU,https://www.wsj.com/articles/illumina-grail-deal-blocked-by-eus-antitrust-regulator-11662463091
277,2022-09-06,Education,Los Angeles Schools Hit With Ransomware Attack,https://www.wsj.com/articles/los-angeles-schools-hit-with-ransomware-attack-11662498999
278,2022-09-06,U.S. Markets,Stocks End Lower After Labor Day Weekend,https://www.wsj.com/articles/global-stocks-markets-dow-update-09-06-2022-11662461384
279,2022-09-06,Stocks,Trump Media SPAC Deal Faces New Challenge: Its Own Investors,https://www.wsj.com/articles/trump-media-spac-deal-faces-new-challenge-its-own-investors-11662477258
280,2022-09-06,Television Review,‘The Anthrax Attacks’ Review: Investigating the Investigation,https://www.wsj.com/articles/the-anthrax-attacks-in-the-shadow-of-9-11-review-netflix-bbc-dan-krauss-clark-gregg-bruce-ivins-paul-keim-john-potter-john-ashcroft-vincent-lisi-11662497417
