,date,subject,headline,headline_link
281,2022-09-06,Exhibition Review,‘FDR’s Final Campaign’ Review: Presidential Race Against Time,https://www.wsj.com/articles/fdrs-final-campaign-review-franklin-d-roosevelt-presidential-library-thomas-e-dewey-harry-s-truman-henry-a-wallace-winston-churchill-joseph-stalin-11662497246
282,2022-09-06,Travel,Companies Weigh the Pros and Cons of Business Trip Vacations,https://www.wsj.com/articles/business-trip-leisure-travel-vacation-bleisure-11662129828
283,2022-09-06,CFO Journal,Bed Bath & Beyond Names Interim CFO After Death of Gustavo Arnal,https://www.wsj.com/articles/bed-bath-beyond-names-laura-crossen-as-interim-cfo-11662471645
284,2022-09-06,U.S.,Labor Board Proposes New Joint Employer Rule,https://www.wsj.com/articles/labor-board-proposes-new-joint-employer-rule-easing-trump-era-limits-11662490507
285,2022-09-06,Crossword,"Crescendo (Wednesday Crossword, September 7)",https://www.wsj.com/articles/crescendo-wednesday-crossword-september-7-11661987350
286,2022-09-06,U.S.,"‘Fat Leonard,’ Former Contractor in Navy Bribery Scandal, Escapes House Arrest",https://www.wsj.com/articles/fat-leonard-former-contractor-in-navy-bribery-scandal-escapes-house-arrest-11662490652
287,2022-09-06,Business,Juul to Pay $438.5 Million to Settle Probe Over Underage Vaping ,https://www.wsj.com/articles/juul-to-pay-438-5-million-to-settle-probe-over-underage-use-11662484340
288,2022-09-06,Pro Bankruptcy International,Zambia Requests $8.4 Billion in Debt Relief From Foreign Creditors,https://www.wsj.com/articles/zambia-requests-8-4-billion-in-debt-relief-from-foreign-creditors-11662489738
289,2022-09-06,Travel,Labor Day Is First Holiday to Top Prepandemic Travel Levels,https://www.wsj.com/articles/labor-day-is-first-holiday-to-top-pre-pandemic-travel-levels-11662491960
290,2022-09-06,U.S.,Nutrition Advocates Urge New Packaged-Food Label,https://www.wsj.com/articles/nutrition-advocates-push-for-front-of-package-labels-that-highlight-fat-sugar-levels-11662456602
291,2022-09-06,Music,"Justin Bieber to Stop Touring Again, Citing Exhaustion",https://www.wsj.com/articles/justin-bieber-to-stop-touring-again-citing-exhaustion-11662490506
292,2022-09-06,U.S.,Where Abortion Is Legal and Where It Loses Protections Without Roe v. Wade,https://www.wsj.com/articles/where-abortion-is-legal-and-where-it-loses-protections-without-roe-v-wade-11656080346
293,2022-09-06,Health,U.S. Plans Shift to Annual Covid Shots,https://www.wsj.com/articles/u-s-plans-shift-to-annual-covid-shots-as-new-boosters-roll-out-11662484424
294,2022-09-06,U.S. Economy,Conflicting Surveys Paint Mixed Picture of Services Providers ,https://www.wsj.com/articles/conflicting-surveys-paint-mixed-picture-of-services-providers-11662487652
295,2022-09-06,Best of the Web,Not a Magic Bus,https://www.wsj.com/articles/not-a-magic-bus-11662487302
296,2022-09-06,◆,WSJ News Exclusive,https://www.wsj.com/articles/inside-the-mission-to-zaporizhzhia-nuclear-plant-shellfire-brinkmanship-and-backchannels-11662465324
297,2022-09-06,Europe,U.N. Atomic Agency Details Zaporizhzhia Nuclear Site Damage,https://www.wsj.com/articles/u-n-atomic-agency-details-zaporizhzhia-nuclear-site-damage-urges-safety-zone-11662484238
298,2022-09-06,Letters,Which Way Forward for the Republican Party?,https://www.wsj.com/articles/republican-party-gop-abortion-policy-11662480650
299,2022-09-06,Letters,Oberlin College Gives Social Justice a Bad Name,https://www.wsj.com/articles/oberlin-college-case-gibson-bakery-social-justice-11662480574
300,2022-09-06,Letters,New SEC Rule on Executive Pay Doesn’t Go Far Enough,https://www.wsj.com/articles/new-sec-rule-executive-pay-company-performance-11662150943
301,2022-09-06,Letters,Water: A Healer and a Danger,https://www.wsj.com/articles/water-swimming-drowning-danger-children-olympic-healing-11662479821
302,2022-09-06,Letters,The IRS Needs Competition,https://www.wsj.com/articles/irs-tax-taxation-customer-service-competition-private-enforcement-11662479672
303,2022-09-06,Letters,The Biden Administration’s ‘Futile and Stupid Gesture’,https://www.wsj.com/articles/student-loan-debt-forgiveness-biden-administration-bluto-11662479499
304,2022-09-06,Politics,Commerce Chief Embraces Policies to Counter China,https://www.wsj.com/articles/commerce-secretary-embraces-a-beefier-industrial-policy-to-combat-china-and-russia-11662469201
305,2022-09-06,Commentary,Biden’s Speech Casts Him as Maxwell Smart,https://www.wsj.com/articles/get-smart-biden-in-86-soul-of-america-president-comedy-partisan-midterms-2022-2024-meacham-maga-republicans-satire-11662457128
306,2022-09-06,Commentary,Liz Truss May Be Just the Prime Minister America Needs,https://www.wsj.com/articles/liz-truss-may-be-just-the-prime-minister-america-needs-britain-boris-johnson-biden-russia-china-iran-nuclear-deal-trade-thatcher-eu-brexit-11662463464
307,2022-09-06,House Call,Rick Lowe Went From the Fields of Alabama to a Solo Exhibit,https://www.wsj.com/articles/rick-lowe-went-from-the-fields-of-alabama-to-a-solo-exhibit-11662480960
308,2022-09-06,Slideshow,The Art of Rick Lowe,https://www.wsj.com/articles/the-art-of-rick-lowe-11662480182
309,2022-09-06,Journal Reports: Technology,The Key to Making Cybersecurity More Accessible to Everyone,https://www.wsj.com/articles/the-key-to-making-cybersecurity-more-accessible-to-everyone-11662166439
310,2022-09-06,Business,"Inflation Cuts Into Pork Profits for Tyson, Seaboard",https://www.wsj.com/articles/inflation-cuts-into-pork-profits-as-tyson-seaboard-report-hit-to-operating-margins-11662435846
311,2022-09-06,China,Sichuan Earthquake Death Toll Climbs as Rescuers Work to Reach Survivors,https://www.wsj.com/articles/sichuan-earthquake-death-toll-climbs-as-rescuers-work-to-reach-survivors-11662458352
312,2022-09-06,Asia,"In Southern Pakistan, a Sea Made of Monsoon Waters Swallows Villages",https://www.wsj.com/articles/in-southern-pakistan-a-sea-made-of-monsoon-waters-swallows-villages-11662456600
313,2022-09-06,Middle East,Israel’s Military Says Its Soldier Likely Killed Al Jazeera Reporter in Error ,https://www.wsj.com/articles/israels-military-says-its-soldier-likely-killed-al-jazeera-reporter-in-error-11662388473
314,2022-09-06,private properties,Asking $65 Million: A 214-Acre Equestrian Estate in the Celebrity-Studded Town of Bedford,https://www.wsj.com/articles/asking-65-million-a-214-acre-equestrian-estate-in-the-celebrity-studded-town-of-bedford-11662473767
315,2022-09-06,Autos Industry,Volkswagen to List Porsche in One of Biggest IPOs in Years,https://www.wsj.com/articles/volkswagen-to-list-porsche-in-one-of-biggest-ipos-in-years-11662413312
316,2022-09-06,The A-Hed,"Gavel Bashing Has Its Moment. ‘You Love That Thing, Don’t You?’",https://www.wsj.com/articles/gavel-pounding-local-government-unruly-times-11662473028
317,2022-09-06,The Future of Everything | Health,Growing a New Type of Organ Donor,https://www.wsj.com/articles/growing-a-new-type-of-organ-donor-11662473054
318,2022-09-06,Journal Reports: Technology,When to Use a VPN—and When It Won’t Protect Your Data,https://www.wsj.com/articles/vpn-data-protection-privacy-tips-11662155750
319,2022-09-06,Property Report,"Miami’s Wynwood Emerging as a Residential, Office Mecca",https://www.wsj.com/articles/miamis-wynwood-neighborhood-is-going-vertical-11662464747
320,2022-09-06,Property Report,Gym Workouts Are Back and Boosting Business at Shopping Centers,https://www.wsj.com/articles/gym-workouts-are-back-and-boosting-business-at-shopping-centers-11662462754
321,2022-09-06,Education,Schools Are Back and Confronting Severe Learning Losses    ,https://www.wsj.com/articles/schools-are-back-and-confronting-devastating-learning-losses-11662472087
322,2022-09-06,Deals,"ADT Draws More Than $1.5 Billion of New Investments From State Farm, Google ",https://www.wsj.com/articles/adt-draws-more-than-1-5-billion-of-new-investments-from-state-farm-google-11662463800
323,2022-09-06,CFO Journal,Bed Bath & Beyond Faces Leadership Gap After Executive’s Death,https://www.wsj.com/articles/bed-bath-beyond-faces-leadership-gap-after-executives-death-11662393909
324,2022-09-06,U.S.,Ghost-Gun Firms Find New Ways to Sell DIY Weapons as U.S. Rule Takes Effect ,https://www.wsj.com/articles/ghost-gun-firms-find-new-ways-to-sell-diy-weapons-as-u-s-rule-takes-effect-11662469201
325,2022-09-06,Business,Railroads Reverse Years of Streamlining in Effort to Improve Freight Service,https://www.wsj.com/articles/railroads-reverse-years-of-streamlining-to-improve-freight-service-11662427522
326,2022-09-06,Heard on the Street,Foreign Funds Place Hopes on India,https://www.wsj.com/articles/foreign-funds-place-hopes-on-india-11662468115
327,2022-09-06,MLB,Aaron Judge Pursues Bid for Home Run Milestone,https://www.wsj.com/articles/new-york-yankees-slugger-aaron-judge-pursues-bid-for-home-run-milestone-11662217200
328,2022-09-06,Fashion,The New Fashion Brand that Wants Women to Claim Space,https://www.wsj.com/articles/new-fashion-brand-women-fforme-italian-wardrobe-staples-11661978853
329,2022-09-06,Style,"Kylian Mbappé, the 23-Year-Old PSG Star, Is the Future of Soccer",https://www.wsj.com/articles/kylian-mbappe-future-soccer-heir-apparent-messi-ronaldo-france-11662427980
330,2022-09-06,Sustainable Business,Fashion Firms Look to Single-Fiber Clothes as EU Regulations Loom ,https://www.wsj.com/articles/fashion-firms-look-to-single-fiber-clothes-as-eu-recycling-regulations-loom-11662467248
331,2022-09-06,Heard on the Street,Volkswagen’s Bad Governance Could Give Porsche IPO Racing Start ,https://www.wsj.com/articles/volkswagens-bad-governance-could-give-porsche-ipo-a-racing-start-11662467080
332,2022-09-06,Risk & Compliance Journal,Next Generation of Risk Professionals Focuses on the Changing Workplace ,https://www.wsj.com/articles/next-generation-of-risk-professionals-focuses-on-the-changing-workplace-11662465601
333,2022-09-06,Europe,Europe’s Odds of Dodging Natural-Gas Shortage Hinge on Winter Weather,https://www.wsj.com/articles/europes-odds-of-dodging-natural-gas-shortage-hinge-on-winter-weather-11662465600
334,2022-09-06,U.K.,"Boris Johnson Bows Out as U.K. Prime Minister, Ending a Tumultuous Three Years in Office",https://www.wsj.com/articles/boris-johnson-bows-out-as-u-k-prime-minister-ending-a-tumultuous-three-years-in-office-11662458331
335,2022-09-06,Heard on the Street,Nvidia’s Close Call Was Too Close ,https://www.wsj.com/articles/nvidias-close-call-was-too-close-11662463980
336,2022-09-06,CFO Journal,Zero-Based Budgeting Gains Clout as a Way for Companies to Find Savings,https://www.wsj.com/articles/zero-based-budgeting-gains-clout-as-a-way-for-companies-to-find-savings-11662463800
337,2022-09-06,Jason Gay,The Long Climb of Tennis Star Frances Tiafoe,https://www.wsj.com/articles/frances-tiafoe-tennis-rafael-nadal-us-open-11662463367
338,2022-09-06,World,Ukraine War Deepens International Cyber-Defense Cooperation,https://www.wsj.com/articles/russias-war-on-ukraine-deepens-international-cyber-defense-cooperation-11662436289
339,2022-09-06,◆,WSJ News Exclusive,https://www.wsj.com/articles/cbre-leads-125-million-vts-funding-round-a-bet-on-technology-for-return-to-office-11662439278
340,2022-09-06,Personal Finance,When It Pays to Have a Mortgage in Retirement—and When It Doesn’t,https://www.wsj.com/articles/when-it-pays-to-have-a-mortgage-in-retirementand-when-it-doesnt-11662409019
341,2022-09-06,Finance,Windfall Taxes Are Latest Hit on Europe’s Banks,https://www.wsj.com/articles/windfall-taxes-are-the-latest-hit-on-europes-banks-11662404349
342,2022-09-06,Finance,Junk-Loan Defaults Worry Wall Street Investors,https://www.wsj.com/articles/junk-loan-defaults-worry-wall-street-investors-11662429632
343,2022-09-06,Commodities,Australia’s Bumper Wheat Crop Faces Export Constraints,https://www.wsj.com/articles/australias-bumper-wheat-crop-faces-export-constraints-11662455441
344,2022-09-06,Crossword,"Could Go Either Way (Tuesday Crossword, September 6)",https://www.wsj.com/articles/could-go-either-way-tuesday-crossword-september-6-11661987250
345,2022-09-06,Pepper & Salt,Pepper...and Salt,https://www.wsj.com/articles/pepper-and-salt-11662436845
346,2022-09-07,Canada,Canada Suspect in Fatal Knife Attacks Dies After Arrest,https://www.wsj.com/articles/police-identify-victims-of-canada-knife-attacks-11662584457
347,2022-09-07,U.S.,Las Vegas Police Arrest Local Official in Death of Journalist,https://www.wsj.com/articles/las-vegas-police-arrest-local-official-in-death-of-journalist-11662607447
348,2022-09-07,Personal Technology: Nicole Nguyen,"Apple Watch Ultra, Series 8 and SE: A Guide to Apple’s New Smartwatch Lineup ",https://www.wsj.com/articles/apple-watch-ultra-series-8-and-se-a-guide-to-apples-new-smartwatch-lineup-11662587683
349,2022-09-07,Personal Technology: Review,"How the iPhone 14, 14 Plus and 14 Pro Compare to Apple’s iPhone 13 Lineup",https://www.wsj.com/articles/how-the-iphone-14-14-plus-and-14-pro-compare-to-apples-iphone-13-lineup-11662587006
350,2022-09-07,Tech,Apple Unveils iPhone 14 Lineup,https://www.wsj.com/articles/iphone-14-lineup-apple-event-launch-11662500247
351,2022-09-07,Commentary,Inflation and the Scariest Economics Paper of 2022,https://www.wsj.com/articles/the-scariest-economics-paper-of-2022-federal-reserve-interest-rates-median-inflation-unemployment-labor-market-job-openings-11662582326
352,2022-09-07,Tech,Judge Lets Musk Cite Informant,https://www.wsj.com/articles/elon-musk-allowed-to-amend-twitter-countersuit-to-add-whistleblower-claims-11662558676
353,2022-09-07,Pro Bankruptcy,Cineworld Files for Chapter 11 After Sluggish Ticket Sales,https://www.wsj.com/articles/sluggish-ticket-sales-drag-regal-owner-cineworld-into-chapter-11-11662562917
354,2022-09-07,Review & Outlook,Gavin Newsom’s Dirty Energy Secret,https://www.wsj.com/articles/gavin-newsoms-dirty-climate-secret-california-rolling-blackouts-green-energy-grid-11662583198
355,2022-09-07,Review & Outlook,"Couy Griffin, Disqualified for Jan. 6?",https://www.wsj.com/articles/disqualified-for-jan-6-judge-francis-mathew-new-mexico-couy-griffin-capitol-riot-11662586737
356,2022-09-07,Review & Outlook,"The NLRB’s War on Franchises, Part II",https://www.wsj.com/articles/the-war-on-franchises-part-ii-national-labor-relations-board-joint-employment-proposed-rule-11662588822
357,2022-09-07,Review & Outlook,Russia’s Ukraine Setbacks,https://www.wsj.com/articles/russias-ukraine-setbacks-vladimir-putin-iran-north-korea-ukraine-weapons-11662501169
358,2022-09-07,Education,Seattle Teachers Strike; District Delays Start of Classes ,https://www.wsj.com/articles/seattle-teachers-strike-district-delays-start-of-classes-11662591921
359,2022-09-07,Personal Technology: Nicole Nguyen,"AirPods Pro Second-Generation: Same Look, Smart Improvements ",https://www.wsj.com/articles/airpods-pro-second-generation-same-look-smart-improvements-11662591660
360,2022-09-07,Health,Amylyx’s ALS Drug Backed by FDA Advisers ,https://www.wsj.com/articles/amylyxs-als-drug-backed-by-fda-advisers-11662590651
361,2022-09-07,Commentary,Democrats Were the First Election Deniers,https://www.wsj.com/articles/democrats-invented-election-denial-2005-bush-kerry-clyburn-jan-6-voting-machines-maga-republicans-biden-speech-11662581117
362,2022-09-07,Commentary,Russian Corporate Mercenaries Move Into Africa ,https://www.wsj.com/articles/russian-corporate-mercenaries-move-into-africa-wagner-group-russia-ukraine-mali-commerce-private-sector-concessions-gold-11662582748
363,2022-09-07,National Security,Oath Keepers Founder Loses Bid to Delay Trial,https://www.wsj.com/articles/oath-keepers-founder-loses-bid-to-delay-seditious-conspiracy-trial-11662590160
364,2022-09-07,U.S.,"ICYMI, Shrinkflation, Pumpkin Spice and MacGyver Are Now in the Dictionary",https://www.wsj.com/articles/icymi-shrinkflation-pumpkin-spice-and-macgyver-are-now-in-the-dictionary-11662589566
365,2022-09-07,Commentary,Who Was That Masked Economist?,https://www.wsj.com/articles/who-was-that-masked-economist-american-economic-association-aea-new-orleans-conference-covid-vaccine-mandate-11662562620
366,2022-09-07,Commentary,A Sweet Lesson in Changing My Opinions,https://www.wsj.com/articles/a-sweet-lesson-in-course-correction-cherry-pumpkin-pie-door-county-lake-michigan-conversation-life-lesson-homemade-11660329203
367,2022-09-07,Bookshelf,‘Prisoners of the Castle’ Review: Escape From Colditz,https://www.wsj.com/articles/prisoners-of-the-castle-review-escape-from-colditz-11662588727
368,2022-09-07,Wonder Land,Take Joe Biden’s Speech Seriously,https://www.wsj.com/articles/take-joe-biden-seriously-speech-maga-republicans-trump-investigate-persecute-democracy-intimidation-11662581177
369,2022-09-07,◆,WSJ News Exclusive,https://www.wsj.com/articles/california-fast-food-wage-law-could-be-overturned-by-proposed-ballot-measure-11662570260
370,2022-09-07,The Future of Everything | Health,What’s Ahead for Health,https://www.wsj.com/articles/whats-ahead-for-health-11662587870
371,2022-09-07,Politics,Democrats Are Set to Narrow Priorities for Short-Term Spending Bill ,https://www.wsj.com/articles/democrats-are-set-to-narrow-their-priorities-for-short-term-spending-bill-11662587767
372,2022-09-07,Heard on the Street,Why Apple Keeps Going Pro,https://www.wsj.com/articles/why-apple-keeps-going-pro-11662587795
373,2022-09-07,Earnings,GameStop Sales Slipped Last Quarter as Loss Widened,https://www.wsj.com/articles/gamestop-sales-slipped-last-quarter-as-loss-widened-11662583429
374,2022-09-07,World,Ukrainian Troops Advance in East as Kyiv Seizes the Initiative ,https://www.wsj.com/articles/ukrainian-troops-advance-in-east-threatening-russian-supply-route-11662544101
375,2022-09-07,Tennis,Frances Tiafoe Advances to U.S. Open Semifinals,https://www.wsj.com/articles/frances-tiafoe-us-open-american-semifinal-11662585692
376,2022-09-07,U.S. Economy,Fed on Path for Another 0.75-Point Interest-Rate Lift After Powell’s Inflation Pledge,https://www.wsj.com/articles/jerome-powells-inflation-fighting-pledge-could-tee-up-another-0-75-point-interest-rate-rise-11662550241
377,2022-09-07,◆,WSJ News Exclusive,https://www.wsj.com/articles/ken-griffin-buyer-behind-106-875-million-miami-deal-11662132323
378,2022-09-07,Business,Amazon CEO Charts Slower Hiring Following Pandemic Boom ,https://www.wsj.com/articles/amazon-ceo-charts-slower-hiring-following-pandemic-boom-11662583104
379,2022-09-07,Financial Regulation,"Fed’s Top Banking Regulator Signals Tougher Merger Reviews, ‘Living Wills’",https://www.wsj.com/articles/feds-top-banking-regulator-calls-for-safer-fairer-financial-system-11662573609
380,2022-09-07,U.S. Markets,"Stocks Rally, Shrugging Off Growth Concerns",https://www.wsj.com/articles/global-stocks-markets-dow-update-09-07-2022-11662546379
381,2022-09-07,private properties,Melissa McCarthy and Ben Falcone Buy Little Italy Penthouse,https://www.wsj.com/articles/melissa-mccarthy-and-ben-falcone-buy-little-italy-penthouse-11662582641
382,2022-09-07,U.S.,"Businesses Expect Economy to Lose More Steam, Fed’s Beige Book Says ",https://www.wsj.com/articles/businesses-expect-economy-to-lose-more-steam-feds-beige-book-says-11662582229
383,2022-09-07,U.S.,Bannon to Face Criminal Charges in New York,https://www.wsj.com/articles/former-trump-strategist-steve-bannon-to-face-criminal-charges-in-new-york-11662557587
384,2022-09-07,Crossword,"Brand Ex (Thursday Crossword, September 8)",https://www.wsj.com/articles/brand-ex-thursday-crossword-september-8-11661987464
385,2022-09-07,Politics,Judge Rules Against Health Law’s Requirement to Cover HIV-Prevention Drugs ,https://www.wsj.com/articles/judge-rules-against-health-laws-requirement-to-cover-hiv-prevention-drugs-11662580586
386,2022-09-07,Risk & Compliance Journal,"Crypto Crash Gives U.S. Bank Regulators ‘Breathing Space,’ Official Says ",https://www.wsj.com/articles/crypto-crash-gives-u-s-bank-regulators-breathing-space-official-says-11662580078
387,2022-09-07,PRIVATE PROPERTIES,Crypto Exec Pays $18.3 Million for Brooklyn Heights Brownstone,https://www.wsj.com/articles/crypto-exec-pays-18-3-million-for-brooklyn-heights-brownstone-11662579978
388,2022-09-07,In The trenches,These Open Houses Were Going Just Fine—Until the Owners Started Acting Up,https://www.wsj.com/articles/these-open-houses-were-going-just-fineuntil-the-owners-started-acting-up-11662578143
389,2022-09-07,Central Banks,Fed’s Mester Says More Rate Rises are Needed Amid Inflation Surge ,https://www.wsj.com/articles/feds-mester-says-more-rate-rises-are-needed-amid-inflation-surge-11662559267
390,2022-09-07,Health,New Covid-19 Booster Shots For This Fall: What to Know,https://www.wsj.com/articles/omicron-fall-booster-shot-11661953623
391,2022-09-07,Gear & Gadgets,How to Make Apple Cider: A Fledgling Brewer’s Guide,https://www.wsj.com/articles/how-to-make-apple-cider-a-fledgling-brewers-guide-11662576301
392,2022-09-07,Politics,Obamas’ Official Portraits Are Unveiled at White House Ceremony,https://www.wsj.com/articles/obamas-official-portraits-are-unveiled-at-white-house-ceremony-11662573986
393,2022-09-07,CIO Journal,‘Predictive-Maintenance’ Tech Is Taking Off as Manufacturers Seek More Efficiency,https://www.wsj.com/articles/predictive-maintenance-tech-is-taking-off-as-manufacturers-seek-more-efficiency-11662543000
394,2022-09-07,World,"Putin Threatens to Abandon Grain Deal, Further Squeeze Energy Supplies",https://www.wsj.com/articles/putin-threatens-to-limit-ukraines-grain-exports-accuses-west-of-deception-11662550822
395,2022-09-07,Business,"Vacationers Pack Flights, but Business Travelers Are Slower to Return",https://www.wsj.com/articles/vacationers-keep-packing-flights-though-business-travelers-are-slower-to-return-11662575003
396,2022-09-07,Health,"New York Ends Covid-19 Mask Mandate for Subway, Buses",https://www.wsj.com/articles/new-york-ends-covid-19-mask-mandate-for-subway-buses-11662566441
397,2022-09-07,Best of the Web,American Dream: Still Serving Winners,https://www.wsj.com/articles/american-dream-still-serving-winners-11662573291
398,2022-09-07,India,"India’s Silicon Valley Flooded, Exposing Infrastructure Woes",https://www.wsj.com/articles/indias-silicon-valley-flooded-by-monsoon-rains-exposing-infrastructure-woes-11662572223
399,2022-09-07,Exhibition Review,‘Guo Pei: Couture Fantasy’ Review: Revolutionary Splendor,https://www.wsj.com/articles/guo-pei-couture-fantasy-review-san-francisco-legion-of-honor-rihanna-jill-dalessandro-martin-leuthold-jakob-schlaepfer-11662571657
400,2022-09-07,Tech,Elon Musk Against Twitter: What to Know About Their Coming Trial,https://www.wsj.com/articles/elon-musk-twitter-trial-delaware-court-11661809622
401,2022-09-07,Tech,Samsung Expects Sharp Downturn in Chip Sales to Extend Into 2023,https://www.wsj.com/articles/samsung-sharp-downturn-in-chip-sales-to-extend-into-next-year-11662537600
402,2022-09-07,Logistics Report,Newell Brands Says Retailers Are Cutting Consumer-Goods Orders,https://www.wsj.com/articles/newell-brands-says-retailers-are-cutting-consumer-goods-orders-11662570443
403,2022-09-07,U.S. Economy,Brainard Says Fed Rate Rises Will Bring Down Inflation,https://www.wsj.com/articles/lael-brainard-says-fed-rate-rises-will-bring-down-inflation-11662568903
404,2022-09-07,Middle East,Iran Expands Nuclear Program as Talks to Revive 2015 Deal Falter,https://www.wsj.com/articles/iran-expands-nuclear-program-as-talks-to-revive-2015-deal-falter-11662569582
405,2022-09-07,Europe,Europe Considers Windfall Levies on Electricity Producers,https://www.wsj.com/articles/europe-considers-windfall-levies-on-electricity-producers-11662569005
406,2022-09-07,Tech,Tencent Deal Cools Investors’ Hopes of Ubisoft Takeover ,https://www.wsj.com/articles/tencent-deal-cools-investors-hopes-of-ubisoft-takeover-11662568591
407,2022-09-07,Art Review,‘Brett Weston’ Review: Images of Mystery,https://www.wsj.com/articles/brett-weston-san-jose-museum-of-art-review-edward-weston-tina-modotti-john-sexton-ansel-adams-cole-weston-11662568121
408,2022-09-07,Obituary,Herbert Kohler Diversified a Toilet Maker Into Golf Courses and Hotels,https://www.wsj.com/articles/herbert-kohler-diversified-a-toilet-maker-into-golf-courses-and-hotels-11662559207
409,2022-09-07,Tech,Google CEO Aims for 20% Productivity Gain ,https://www.wsj.com/articles/google-ceo-sundar-pichai-aims-for-20-productivity-gain-11662565214
410,2022-09-07,Journal Reports: Technology,Why Sports Teams Could Be a Big Target for Hackers,https://www.wsj.com/articles/hacking-sports-teams-vulnerable-11662560183
411,2022-09-07,market makers,A $19.445 Million Home With Its Own Vineyard Becomes Sedona’s Priciest Listing,https://www.wsj.com/articles/a-19-445-million-home-with-its-own-vineyard-becomes-sedonas-priciest-listing-11662566451
412,2022-09-07,U.S.,"Austin Airport Power Outage Leads to Flight Delays, Cancellations",https://www.wsj.com/articles/austin-airport-suffers-power-outage-leading-to-flight-delays-11662558269
413,2022-09-07,World,"Who Is Liz Truss, the Next U.K. Prime Minister?",https://www.wsj.com/articles/liz-truss-who-prime-minister-united-kingdom-11662373260
414,2022-09-07,Commentary,Higher Education Can Rediscover Its Purpose,https://www.wsj.com/articles/higher-ed-can-rediscover-its-purpose-education-college-university-students-loans-debt-enrollments-drop-out-rate-employment-11662557865
415,2022-09-07,Commentary,Shareholders Stand Up for Profit and Against ESG at Chevron,https://www.wsj.com/articles/shareholders-stand-up-for-profit-at-chevron-esg-big-three-blackrock-vanguard-state-street-paris-agreement-scope-3-emissions-strive-11662558395
416,2022-09-07,◆,WSJ News Exclusive,https://www.wsj.com/articles/netflix-hunts-for-cost-cuts-from-cloud-computing-to-corporate-swag-11662565220
417,2022-09-07,The Future of Everything | Health,An ACL Tear That Heals Itself?,https://www.wsj.com/articles/an-acl-tear-that-heals-itself-11662564861
