,date,subject,headline,headline_link
558,2022-09-08,Letters,Jackson Mayor Tries and Fails to Duck the Water Crisis,https://www.wsj.com/articles/jackson-water-plant-crisis-drinking-mayor-city-council-chokwe-lumumba-11662585314
559,2022-09-08,Europe,"Baltic States, Poland to Cut Land Route to EU for Most Russian Visa Holders",https://www.wsj.com/articles/baltic-states-poland-to-cut-land-route-to-eu-for-most-russian-visa-holders-11662646846
560,2022-09-08,Letters,A Success in Alaska for Ranked-Choice Voting?,https://www.wsj.com/articles/alaska-ranked-choice-voting-rcv-palin-begich-election-11662584671
561,2022-09-08,The A-Hed,The Roadside Attraction Era Lives On With a 30-Foot Bobblehead Waiter,https://www.wsj.com/articles/road-trip-attractions-ohio-jacques-11662583998
562,2022-09-08,Autos Industry,"Rivian, Mercedes to Partner on Electric-Van Factory ",https://www.wsj.com/articles/rivian-mercedes-to-partner-on-electric-van-factory-11662646684
563,2022-09-08,Finance,"Mortgage Rates Hit 5.89%, Highest Level Since 2008",https://www.wsj.com/articles/mortgage-rates-hit-5-89-highest-level-since-2008-11662646125
564,2022-09-08,Letters,What Does the Cost of a Child Really Tell You?,https://www.wsj.com/articles/child-cost-children-family-birth-rate-love-11662584107
565,2022-09-08,Letters,Ukraine’s Zelensky Follows in the Path of John Adams,https://www.wsj.com/articles/ukraine-zelensky-wsj-money-investment-john-adams-dutch-bankers-11662583668
566,2022-09-08,U.S. Economy,Jobless Claims Fall for Fourth Straight Week,https://www.wsj.com/articles/u-s-jobless-claims-fall-for-fourth-straight-week-11662641304
567,2022-09-08,Letters,Trump Gets No Respect on Foreign Policy,https://www.wsj.com/articles/trump-foreign-policy-border-middle-east-china-diplomacy-11662583155
568,2022-09-08,Letters,Teachers Union Boss Deflects Responsibility,https://www.wsj.com/articles/teachers-union-boss-randi-weingarten-pandemic-school-closures-learning-loss-11662582790
569,2022-09-08,Journal Reports: Technology,How Leaders Can Create a Cybersecure Workplace Culture,https://www.wsj.com/articles/cybersecurity-workplace-culture-management-11662580052
570,2022-09-08,Number Puzzles,"Number Puzzles (Saturday, September 10)",https://www.wsj.com/articles/number-puzzles-saturday-september-10-11662579119
571,2022-09-08,Essay,Who Will Pay the Price for Cyberattacks?,https://www.wsj.com/articles/who-will-pay-the-price-for-cyberattacks-11662645501
572,2022-09-08,U.K.,U.K. Government to Cap Household Energy Prices for Two Years,https://www.wsj.com/articles/u-k-government-to-cap-household-energy-prices-for-two-years-11662634632
573,2022-09-08,Heard on the Street,Bank of Japan Can Stomach Weak Yen,https://www.wsj.com/articles/bank-of-japan-can-stomach-weak-yen-11662643391
574,2022-09-08,Autos Industry,"Tesla Deliveries From China Factory Jump, but BYD Races Ahead",https://www.wsj.com/articles/tesla-deliveries-from-shanghai-factory-jump-but-byd-races-ahead-in-china-11662633237
575,2022-09-08,Off Duty Travel,Why Fall—Not Summer—Is the Best Time for an Island Vacation,https://www.wsj.com/articles/vacation-guide-bali-croatia-kiawah-island-prince-edward-island-capri-11662586717
576,2022-09-08,Autos Industry,"GM Courts Mainstream Buyers with $30,000 Electric Chevy Equinox ",https://www.wsj.com/articles/gm-courts-mainstream-buyers-with-30-000-electric-chevy-equinox-11662642001
577,2022-09-08,What's News,Neil deGrasse Tyson Doesn’t Let His Phone Control Him,https://www.wsj.com/articles/neil-degrasse-tyson-astrophysicist-author-phone-11662561794
578,2022-09-08,Food,What’s on  Will Guidara’s Plate?,https://www.wsj.com/articles/will-guidara-restaurateur-return-new-york-city-welcome-conference-hbo-max-11662564186
579,2022-09-08,Fashion,The Five Coolest Men’s Accessories to Buy Now,https://www.wsj.com/articles/five-coolest-mens-accessories-fall-season-buy-now-chill-vibes-11662637478
580,2022-09-08,Design,Summer Patio Flowers That Can Live Indoors All Winter,https://www.wsj.com/articles/best-cold-weather-houseplants-geraniums-african-mallow-coleus-begonias-11662585190
581,2022-09-08,U.S.,"Police, Car Owners Wrestle With Growing Thefts of Kias, Hyundais",https://www.wsj.com/articles/police-car-owners-wrestle-with-growing-thefts-of-kias-hyundais-11662638401
582,2022-09-08,THE EXPERTS | Leadership,"Why Companies Need to Think About Cyber Resilience, Not Just Cybersecurity",https://www.wsj.com/articles/why-companies-need-to-think-about-cyber-resilience-not-just-cybersecurity-11662566775
583,2022-09-08,Tech,Trial of Former Uber Executive Has Security Officials Worried About Liability for Hacks ,https://www.wsj.com/articles/trial-of-former-uber-executive-has-security-officials-worried-about-liability-for-hacks-11662638107
584,2022-09-08,CFO Journal,DSW Shoe Store Parent Leans on Deal Making to Boost Sales of Brands It Owns,https://www.wsj.com/articles/dsw-shoe-store-parent-leans-on-deal-making-to-boost-sales-of-brands-it-owns-11662636600
585,2022-09-08,Heard on the Street,Banks’ Funding Questions Aren’t Going Away ,https://www.wsj.com/articles/banks-funding-questions-arent-going-away-11662634980
586,2022-09-08,Pro PE Deals,"FFL Sells Stake in CFO-Services Provider Accordion to Charlesbank, Motive ",https://www.wsj.com/articles/ffl-sells-stake-in-cfo-services-provider-accordion-to-charlesbank-motive-11662634802
587,2022-09-08,◆,WSJ News Exclusive,https://www.wsj.com/articles/rumble-makes-play-for-tv-news-audiences-with-daily-news-shows-11662634800
588,2022-09-08,Health,FDA Approves New Botox Rival,https://www.wsj.com/articles/fda-approves-new-botox-rival-11662634800
589,2022-09-08,Business,United to Invest $15 Million in Flying-Taxi Maker,https://www.wsj.com/articles/united-to-invest-15-million-in-flying-taxi-maker-backed-by-embraer-11662607183
590,2022-09-08,JASON GAY,Tennis at 2:50 A.M.? A Record-Setting Late Match Stirs the U.S. Open,https://www.wsj.com/articles/carlos-alcaraz-us-open-jannik-sinner-marathon-11662630509
591,2022-09-08,China,China Tightens Travel Restrictions as Covid Fight Intensifies,https://www.wsj.com/articles/china-tightens-travel-restrictions-as-covid-fight-intensifies-11662633197
592,2022-09-08,homes,First They Purchased a House. Then They Bought Up the Entire Town.,https://www.wsj.com/articles/first-they-purchased-a-house-then-they-bought-up-the-entire-town-11662587206
593,2022-09-08,Credit Markets,Broad Bond Declines Bring Rare Bear Market,https://www.wsj.com/articles/broad-declines-drag-bonds-into-rare-bear-market-11662602793
594,2022-09-08,Markets,"Audit Deal or No Deal, Chinese Companies May Avoid Delisting",https://www.wsj.com/articles/u-s-audit-deal-or-no-deal-dozens-of-chinese-companies-believe-they-wont-have-to-delist-11662630454
595,2022-09-08,World,China’s Lending Strategy in Emerging Markets Risks Prolonging Borrowers’ Pain,https://www.wsj.com/articles/chinas-lending-strategy-in-emerging-markets-risks-prolonging-borrowers-pain-11662629962
596,2022-09-08,Science of Success,Amazon Wanted a Lord of the Rings Show. It Turned to Frodo and Sam.,https://www.wsj.com/articles/rings-of-power-lotr-amazon-jd-payne-patrick-mckay-11662605833
597,2022-09-08,Tech,"Apple’s New iPhones Create Buzz in China, but Local Rivals Loom",https://www.wsj.com/articles/apples-new-iphones-create-buzz-in-china-but-local-rivals-loom-11662629401
598,2022-09-08,Journal Reports: Wealth Management,Year-End Tax Moves That Investors Should Consider,https://www.wsj.com/articles/smart-tax-moves-investors-to-consider-before-dec-31-11662486688
599,2022-09-08,Politics,U.S. Expects to Use All Jobs-Based Green Cards This Year,https://www.wsj.com/articles/u-s-expects-to-use-all-employment-based-green-cards-this-year-11662627600
600,2022-09-08,Television Review,‘Pinocchio’ Review: Disney’s Wooden Remake,https://www.wsj.com/articles/pinocchio-review-robert-zemeckis-tom-hanks-carlo-collodi-benjamin-evan-ainsworth-joseph-gordon-levitt-keegan-michael-key-cynthia-erivo-jaquita-tale-giuseppe-battiston-chris-weitz-11662567494
601,2022-09-08,World,These Remote Australian Islands Could Determine the Future of Offshore Drilling,https://www.wsj.com/articles/in-dispute-over-gas-project-evidence-includes-sacred-dances-on-remote-australian-island-11662543001
602,2022-09-08,Tech,Tim Cook Advises Man Concerned About Green Text Bubbles: ‘Buy Your Mom an iPhone’,https://www.wsj.com/articles/tim-cook-advises-man-concerned-about-green-text-bubbles-buy-your-mom-an-iphone-11662614342
603,2022-09-08,Tech,Snap CEO Sees Challenges in Executing Turnaround Drive,https://www.wsj.com/articles/snap-ceo-sees-challenges-in-executing-turnaround-drive-11662610497
604,2022-09-08,on the clock,What the #@$%! Happened to Our Manners at Work?,https://www.wsj.com/articles/what-the-happened-to-our-manners-at-work-11662584091
605,2022-09-08,Your Health,"A Key to Long Covid Is Virus Lingering in the Body, Scientists Say",https://www.wsj.com/articles/a-key-to-long-covid-is-virus-lingering-in-the-body-scientists-say-11662590900
606,2022-09-08,Pepper & Salt,Pepper...and Salt,https://www.wsj.com/articles/pepper-and-salt-11662609614
607,2022-09-09,Politics,Trump Lawyers Oppose DOJ’s Bid to Resume Review of Seized Classified Materials ,https://www.wsj.com/articles/trump-lawyers-oppose-justice-departments-bid-to-resume-review-of-seized-classified-materials-11662776232
608,2022-09-09,U.S.,Supreme Court Temporarily Grants University’s Request to Block Gay Student Group ,https://www.wsj.com/articles/supreme-court-temporarily-grants-universitys-request-to-block-gay-student-group-11662768749
609,2022-09-09,Commodities,Treasury Tells Firms How to Comply With Russian Oil-Price Cap,https://www.wsj.com/articles/treasury-releases-guidance-on-russian-oil-price-cap-compliance-11662766354
610,2022-09-09,Education,Columbia Says It Reported Incorrect Figures in U.S. News Ranking,https://www.wsj.com/articles/columbia-acknowledges-reporting-incorrect-figures-in-past-u-s-news-ranking-11662765674
611,2022-09-09,Tech,Musk Lawyer Cites Twitter Payment to Whistleblower as Reason to Drop Takeover ,https://www.wsj.com/articles/elon-musk-lawyer-cites-twitters-whistleblower-payment-as-new-reason-to-drop-44-billion-takeover-11662764461
612,2022-09-09,Review & Outlook,How the Feds Coordinate With Facebook on Censorship,https://www.wsj.com/articles/how-the-feds-coordinate-with-facebook-twitter-white-house-social-media-emails-covid-instagram-11662761613
613,2022-09-09,Business,"Twitter, Bed Bath & Beyond, Kroger: Stocks That Defined the Week",https://www.wsj.com/articles/twitter-bed-bath-beyond-kroger-stocks-that-defined-the-week-11662763838
614,2022-09-09,MLB,MLB Will Voluntarily Recognize Unionization Efforts of Minor Leaguers,https://www.wsj.com/articles/mlb-minor-league-players-union-mlbpa-11662763573
615,2022-09-09,Review & Outlook,A White House Student Loan Forgiveness Whopper,https://www.wsj.com/articles/a-white-house-student-loan-whopper-debt-write-offs-deficit-11662756862
616,2022-09-09,Review & Outlook,Democrats for MAGA Republicans,https://www.wsj.com/articles/democrats-for-maga-republicans-new-hampshire-republicans-don-bolduc-chuck-morse-maggie-hassan-11662759677
617,2022-09-09,Review & Outlook,Elections and Crime in Seattle,https://www.wsj.com/articles/elections-and-crime-control-in-seattle-city-attorney-ann-davison-police-bruce-harrell-11662156673
618,2022-09-09,Art Review,Independent 20th Century and the Armory Show—Conflicting Visions,https://www.wsj.com/articles/armory-show-review-independent-20th-century-juanita-mcneely-james-fuentes-max-beckmann-francis-bacon-stanislao-lepri-chico-da-silva-galatea-joseph-e-yoakum-richard-mayhew-tidawhitney-lek-dale-lewis-nick-angelo-claire-oswalt-jake-longstreth-matthias-weischer-caroline-walker-arturo-kameya-armory-show-11662761957
619,2022-09-09,World,Ukraine’s Rapid Advance in East Puts Russian Forces on Defensive,https://www.wsj.com/articles/ukraines-eastern-advance-puts-forces-close-to-key-town-11662718470
620,2022-09-09,Masterpiece,History as Told by the Vanquished,https://www.wsj.com/articles/curzio-malaparte-kaputt-masterpiece-corriere-della-sera-mussolini-hans-frank-heinrich-himmler-chagall-repin-grosz-bosch-ante-pavelic-milan-kundera-11662761803
621,2022-09-09,U.S.,"California Wildfires Force Evacuations, While Fire Threat in Oregon Causes Power Shutdowns",https://www.wsj.com/articles/california-wildfires-force-evacuations-while-fire-threat-in-oregon-causes-power-shutdowns-11662748959
622,2022-09-09,Cultural Commentary,Queen Elizabeth II: Cultural Icon,https://www.wsj.com/articles/queen-elizabeth-ii-as-a-cultural-icon-cultural-commentary-cecil-beaton-the-beatles-pietro-annigoni-silver-jubilee-jamie-reid-lucian-freud-andy-warhol-justin-mortimer-helen-mirren-stephen-frears-peter-morgan-claire-foy-olivia-colman-james-bond-daniel-craig-chris-levine-11662761714
623,2022-09-09,Risk & Compliance Journal,"U.S. Sanctions Iranian Intelligence Ministry, Its Leader Over Hacks ",https://www.wsj.com/articles/u-s-sanctions-iranian-intelligence-ministry-and-its-leader-citing-alleged-hacks-11662760829
624,2022-09-09,Health,"What to Know About Polio Symptoms, Vaccines and the Virus’s Spread in New York",https://www.wsj.com/articles/what-is-polio-virus-symptoms-11660340355
625,2022-09-09,Risk & Compliance Journal,"Crypto Complaints Not Deterring SEC Enforcement Approach, Official Says ",https://www.wsj.com/articles/crypto-complaints-not-deterring-sec-enforcement-approach-official-says-11662760315
626,2022-09-09,Commentary,"An American Mourns His Queen, Elizabeth II",https://www.wsj.com/articles/an-american-mourns-his-queen-elizabeth-ii-monarchy-u-k-citizenship-allegiance-oath-america-affection-11662749034
627,2022-09-09,Commentary,The Scandal Rocking the Chess World,https://www.wsj.com/articles/the-scandal-rocking-the-chess-world-grandmaster-magnus-carlsen-cheating-loss-defeat-game-tournament-allegation-11662750954
628,2022-09-09,Commentary,Bend Stood Tall Against a Mass Shooter,https://www.wsj.com/articles/bend-stood-tall-against-a-mass-shooter-rifle-violence-attack-armed-knife-handgun-veteran-killing-police-officers-wounded-11662751345
629,2022-09-09,Health,New York Governor Declares Polio a State Disaster Emergency ,https://www.wsj.com/articles/new-york-governor-declares-polio-a-state-disaster-emergency-11662743340
630,2022-09-09,The Weekend Interview,A Betting Man With a Plan for America,https://www.wsj.com/articles/a-betting-man-with-a-plan-to-save-america-poker-odds-school-choice-war-climate-policy-donor-markets-prediction-invest-11662755750
631,2022-09-09,World,Ukraine Considers Shutting Nuclear Plant After Loss of Backup Power ,https://www.wsj.com/articles/ukraine-considers-shutting-nuclear-plant-after-loss-of-backup-power-11662747396
632,2022-09-09,HEARD ON THE STREET,Europe’s Energy Crunch Could Spark Flashbacks to the Eurozone Crisis,https://www.wsj.com/articles/europes-energy-crunch-could-spark-flashbacks-to-the-eurozone-crisis-11662727543
633,2022-09-09,Fashion,Thigh-High Boots—Not Just for Dominatrixes Anymore,https://www.wsj.com/articles/womens-boots-fall-fashion-thigh-high-boots-11662754394
634,2022-09-09,U.S. Markets,"Stocks Climb, Finish the Week With Gains",https://www.wsj.com/articles/global-stocks-markets-dow-update-09-09-2022-11662725916
635,2022-09-09,Economy,Transcript: WSJ Interview With Cleveland Fed President Loretta Mester,https://www.wsj.com/articles/transcript-wsj-interview-with-cleveland-fed-president-loretta-mester-11662755187
636,2022-09-09,Deals,Trump Media SPAC Extends Merger Deadline,https://www.wsj.com/articles/trump-media-spac-extends-merger-deadline-11662745109
637,2022-09-09,Best of the Web,"Beyond the Beltway, a ‘Flat Tax Revolution’",https://www.wsj.com/articles/beyond-the-beltway-a-flat-tax-revolution-11662754953
638,2022-09-09,Tech,Alphabet Health Unit Founder Exits Amid Move to Commercial Uses,https://www.wsj.com/articles/alphabet-health-unit-founder-exits-as-company-targets-commercial-uses-11662754820
639,2022-09-09,U.S. Economy,Fed Officials Back Another Large Rate Increase,https://www.wsj.com/articles/fed-official-supports-another-significant-increase-in-interest-rates-this-month-11662739221
640,2022-09-09,Crossword,"Animal Crackers (Saturday Crossword, September 10)",https://www.wsj.com/articles/animal-crackers-saturday-crossword-september-10-11662741972
641,2022-09-09,Acrostic,"The Journal Acrostic (Saturday Variety Puzzle, September 10)",https://www.wsj.com/articles/the-journal-acrostic-saturday-variety-puzzle-september-10-11662742146
642,2022-09-09,Icons,Olafur Eliasson Is a Sculptor of Vision,https://www.wsj.com/articles/olafur-eliasson-is-a-sculptor-of-vision-11662753426
643,2022-09-09,Financial Regulation,Treasury to Warn of Crypto Risks,https://www.wsj.com/articles/treasury-to-warn-of-crypto-risks-11662742472
644,2022-09-09,Logistics Report,Amazon Refines Delivery Operations as It Resets Logistics Network,https://www.wsj.com/articles/amazon-is-refining-delivery-operations-as-it-resets-logistics-network-11662752668
645,2022-09-09,Finance,Robinhood Index to Track Customers’ Favored Stocks,https://www.wsj.com/articles/robinhood-unveils-index-to-track-customers-favored-stocks-11662748639
646,2022-09-09,BOOKSHELF,16 Books We Read This Week,https://www.wsj.com/articles/16-books-we-read-this-week-11662752207
647,2022-09-09,U.K.,Prince Charles Becomes King. What to Know About King Charles III.,https://www.wsj.com/articles/prince-charles-becomes-king-what-to-know-about-britains-new-monarch-11662677405
648,2022-09-09,Food & Drink,"How to Cook Duck: Pro Tips and a Simple, Fallish Recipe",https://www.wsj.com/articles/how-to-cook-duck-pro-tips-and-a-simple-fallish-recipe-11662751800
649,2022-09-09,Letters,The Met Replies on the Politics of Art Museums,https://www.wsj.com/articles/the-met-art-museums-woke-politics-slavery-white-exhibition-date-night-context-11662679538
650,2022-09-09,Letters,Jackson’s Water and the Crisis of Municipal Governance,https://www.wsj.com/articles/jackson-clean-water-plant-city-flint-government-private-11662678040
651,2022-09-09,Letters,Pandemic Can’t Excuse Declines in Reading,https://www.wsj.com/articles/reading-scores-schools-education-learning-loss-pandemic-naep-11662677850
652,2022-09-09,Letters,"Herb Kohler Kept His Word to Me, the Customer",https://www.wsj.com/articles/kohler-kitchen-fixture-product-warranty-customer-service-11662677064
653,2022-09-09,Letters,I’m Grateful That Tie-Dye Isn’t Dead,https://www.wsj.com/articles/grateful-dead-and-co-tie-dye-t-shirt-band-11662676185
654,2022-09-09,Letters,Mitch Daniels for President?,https://www.wsj.com/articles/mitch-daniels-purdue-university-tuition-college-loans-president-11662676747
655,2022-09-09,Asia,"U.S., Asia-Pacific Partners Take Early Step on Trade",https://www.wsj.com/articles/u-s-asia-pacific-partners-take-early-step-on-trade-11662750544
656,2022-09-09,Autos Industry,Tesla Looking Into Building Lithium Refinery,https://www.wsj.com/articles/tesla-looking-into-building-lithium-refinery-in-north-america-11662742270
657,2022-09-09,Commentary,Policies Pushing Electric Vehicles Show Why Few People Want One,https://www.wsj.com/articles/policies-pushing-electric-vehicles-show-why-few-people-want-one-cars-clean-energy-gasoline-emissions-co2-carbon-electricity-11662746452
658,2022-09-09,Cross Country,Don’t Make Massachusetts ‘Taxachusetts’ Again,https://www.wsj.com/articles/remember-taxachusetts-voters-are-being-asked-to-bring-it-back-massachusetts-constitutional-amendment-surcharge-warren-wage-exodus-capital-gains-budget-surplus-tax-hike-11662746202
659,2022-09-09,U.K.,King’s Challenge Is to Strengthen the Monarchy While Changing It,https://www.wsj.com/articles/king-charless-challenge-is-to-strengthen-the-monarchy-as-he-changes-it-11662749721
660,2022-09-09,U.K.,King Charles Pays Tribute to Queen Elizabeth in Heartfelt Speech,https://www.wsj.com/articles/king-charles-iiis-reign-dawns-as-britain-mourns-loss-of-queen-elizabeth-ii-11662717437
661,2022-09-09,Bookshelf,‘Free Market’ Review: The Olympians v. Laissez-Faire ,https://www.wsj.com/articles/free-market-book-review-economic-history-the-olympians-v-laissez-faire-11662747071
662,2022-09-09,CIO Journal,Walgreens Names Hsiao Wang as Next CIO ,https://www.wsj.com/articles/walgreens-names-hsiao-wang-as-next-cio-11662747028
663,2022-09-09,Earnings,"Kroger’s Sales, Profits Grow as U.S. Shoppers Prioritize Essentials ",https://www.wsj.com/articles/kroger-lifts-guidance-after-quarterly-sales-rise-9-11662729109
664,2022-09-09,Everyday Math,What Cocktails Share with Cicadas,https://www.wsj.com/articles/what-cocktails-share-with-cicadas-11662746279
665,2022-09-09,Logistics Report,Amazon Buys Warehouse Robotics Company Cloostermans ,https://www.wsj.com/articles/amazon-buys-warehouse-robotics-company-cloostermans-11662746152
666,2022-09-09,Off Duty Travel,Renting a Villa in Tuscany Is the Ultimate Staycation,https://www.wsj.com/articles/tuscany-villa-rentals-italy-vacation-guide-11662745409
667,2022-09-09,U.K.,"With Queen’s Death, William Is Thrust Into Limelight as His Father’s Heir",https://www.wsj.com/articles/with-queens-death-william-is-thrust-into-the-limelight-as-his-fathers-heir-11662726509
668,2022-09-09,Politics,Judge Dismisses Trump Lawsuit Against Hillary Clinton,https://www.wsj.com/articles/judge-dismisses-donald-trumps-lawsuit-against-hillary-clinton-11662734926
669,2022-09-09,Business,"Summer Movie Season Fizzles Out, With Few Blockbusters to Count On This Fall",https://www.wsj.com/articles/summer-movie-season-fizzles-out-with-few-blockbusters-to-count-on-this-fall-11662715802
670,2022-09-09,Journal Reports: Wealth Management,Her Goal Is to Eliminate Credit-Card Debt in About a Year. Can She Do It?,https://www.wsj.com/articles/eliminate-credit-card-debt-plan-11662488666
671,2022-09-09,Europe,"France, Germany and Other EU Nations to Advance Minimum Tax",https://www.wsj.com/articles/france-germany-and-others-pledge-to-advance-minimum-tax-despite-hungary-veto-11662736518
672,2022-09-09,hEARD ON THE sTREET,Kroger Keeps Ringing the Register,https://www.wsj.com/articles/kroger-keeps-ringing-the-register-11662741486
673,2022-09-09,Weekend Confidential,Dick Ebersol Found the Magic of Sports Behind the Camera,https://www.wsj.com/articles/dick-ebersol-found-the-magic-of-sports-behind-the-camera-11662740998
674,2022-09-09,Europe,European Governments Back Energy-Market Interventions,https://www.wsj.com/articles/europe-holds-emergency-talks-on-energy-market-intervention-11662713678
675,2022-09-09,Business,Derek Jeter Wants In on the Booming Market for Baseball Cards,https://www.wsj.com/articles/derek-jeter-wants-in-on-the-booming-market-for-baseball-cards-11662740202
676,2022-09-09,Central Banks,Fed’s George Says Central Bank Must Press Forward With Increases ,https://www.wsj.com/articles/feds-george-says-central-bank-must-press-forward-with-increases-11662739172
677,2022-09-09,Film,"Queen Elizabeth II Wasn’t Just a Queen. She Was a Character, Too.",https://www.wsj.com/articles/queen-elizabeth-the-crown-movies-tv-11662738886
678,2022-09-09,Business Education,The Ultimate M.B.A. Networking Event? A Yacht Party in Croatia.,https://www.wsj.com/articles/the-ultimate-m-b-a-networking-event-a-yacht-party-in-croatia-11662738835
679,2022-09-09,Midterm Election 2022,Kevin McCarthy’s Fraught Path to Power,https://www.wsj.com/articles/kevin-mccarthy-republican-house-speaker-midterm-elections-11662505517
680,2022-09-09,Bookshelf,"‘Volt Rush’ Review: Electric Cars, Money and Mines",https://www.wsj.com/articles/volt-rush-book-review-electric-vehicles-batteries-not-included-11662735818
681,2022-09-09,The Intelligent Investor,Municipal Bonds Suddenly Look Cheap. Some Are Tax Traps.,https://www.wsj.com/articles/municipal-bonds-suddenly-look-cheap-some-are-tax-traps-11662735718
682,2022-09-09,Journal Reports: Wealth Management,Why Drinking Coffee Can Make You Spend More Money,https://www.wsj.com/articles/coffee-caffeine-can-make-you-spend-more-money-11662489221
683,2022-09-09,Essay,Spin Training Teaches the Value of ‘Airmanship’,https://www.wsj.com/articles/spin-training-teaches-the-value-of-airmanship-11662735514
684,2022-09-09,Obituaries,"Cyrus Mistry, Ousted as Chief of India’s Tata Sons, Dies at 54 ",https://www.wsj.com/articles/cyrus-mistry-ousted-as-chief-of-indias-tata-sons-dies-at-54-11662734314
685,2022-09-09,Cultural Commentary,Black Sabbath’s ‘Vol. 4’ Turns 50,https://www.wsj.com/articles/-black-sabbath-vol-4-cultural-commentary-jimi-hendrix-jimmy-page-ritchie-blackmore-tony-iommi-lester-bangs-tom-clark-ozzy-osbourne-geezer-butler-bill-ward-james-hetfield-11662734404
686,2022-09-09,Bookshelf,‘Let’s Do It’ Review: Pop Music’s Hit Parade,https://www.wsj.com/articles/lets-do-it-book-review-history-pop-music-hit-parade-11662733576
687,2022-09-09,Bookshelf,"Children’s Books: A Sense of Place, a Remembrance of Woe",https://www.wsj.com/articles/childrens-books-review-a-sense-of-place-a-remembrance-of-woe-11662732982
688,2022-09-09,Gear & Gadgets,In Search of a Silent Leaf Blower,https://www.wsj.com/articles/best-leaf-blowers-quiet-11662732496
689,2022-09-09,The A-Hed,Europe’s Energy Crisis Brings Calls for 5-Minute Showers. Not All Are Keen on That.    ,https://www.wsj.com/articles/europes-energy-crisis-brings-calls-for-5-minute-showers-not-all-are-keen-on-that-11662732248
690,2022-09-09,Bookshelf,‘Democratic Justice’ Review: Felix Frankfurter’s Double Act,https://www.wsj.com/articles/democratic-justice-book-review-felix-frankfurters-double-act-11662732111
691,2022-09-09,Obituaries,Peter Eckersley Helped Encrypt Internet Traffic to Foil Snoops ,https://www.wsj.com/articles/peter-eckersley-helped-encrypt-internet-traffic-to-foil-snoops-11662732014
692,2022-09-09,Bookshelf,Mysteries: Joël Dicker’s ‘The Enigma of Room 622’,https://www.wsj.com/articles/mysteries-book-review-joel-dickers-the-enigma-of-room-622-11662731945
